NA	Kes칛lahti	1981-06-01	"Vuosi oli 1981. Elettiin alkukes칛칛. Parhaillaan olivat menossa koulujen p칛칛sykokeet. Olin juuri aloittanut seurustelun. Tytt칬yst칛v칛ni kaksoissisko oli saanut p칛칛h칛ns칛빯yrki칛 sairaanhoito-opplaitokseen Helsinkiin. Minut houkuteltiin kuskiski. Kokeet olivat yksip칛iv칛iset. En muista, mik칛 viikonp칛iv칛 se oli, mutta oletan, ett칛 se oli maanantai. L칛ht칬 oli siis sunnuntain ja maanantain v칛lisen칛 y칬n칛 klo 01.00. Mukaan l칛htiv칛t paitsi sisarukset my칬s heid칛n pikkuveljens칛. Olimme matkassa heid칛n is칛ns칛 autolla. 
Menomatka sujui joutuisasti. Norkoilimme"	Ei	kyll칛	kyll칛	kyll칛	kyll칛	http://fufora.fi/ufodb/ufodata.php?u=319&p=1	61.8918214	29.8272654	h칛m칛r칛
NA	Vaasa	1992-01-01	Olin lenkkeilem칛ss칛 illalla (oli valoisaa). Katselin peltomaisemaa ja huomasin oudon valon (kirkas esine), joka pysyi paikallaan. J칛in katsomaan ja ihmettelem칛칛n hetkeksi ja etsin aurinkoa, jonka olisi pit칛nyt olla manosuunnassani. Ajattelin, ett칛 n칛en omiani ja k칛칛nsin p칛칛ni toiseen suuntaan, mutta siit칛 huolimatta valo oli paikallaan. Kirkas valo painui rauhallisesti mets칛 taakse ja odotin viel칛 hetken aikaa ennenkuin palasin kotiini. Odotin josko viel칛 n칛kisin sen uudelleen. Kerroin asiasta heti yst칛v칛lleni ja tuumasin, ett칛 n칛in jotain tosi	Ei	ei	kyll칛	ei	ei	http://fufora.fi/ufodb/ufodata.php?u=320&p=1	63.09508899999999	21.6164564	auringonlasku_tai_nousu
NA	Kontiolahti	1994-06-16	"Olimme viett칛m칛ss칛 pikkujuhannusta H칬yti칛isen rannalla viikkoa ennen juhannusta. Paikalla oli kymmenisen henke칛. Olin juuri siemaisemassa ensimm칛isest칛 oluttuopistani kun n칛in ulapalla sikarinmuotoisen valon joka suureni koko ajan ja pian se ylitti meid칛t valtavalla nopudella.Kaikki katsoivat samaan suuntaan. Ufon korkeus oli kumpupilvien rajassa.Kukaan ei kommentoinut mit칛칛n, oli vain hiljaista ja tapauksen j칛lkeen kaikki jatkoivat normaalisti iltaa puhumatta asiasta mit칛칛n kesken칛칛n. 
Seuraavana maanantaina kuitenkin er칛s paikalla olleista tu"	Ei	kyll칛	ei	ei	kyll칛	http://fufora.fi/ufodb/ufodata.php?u=321&p=1	62.7643378	29.8474185	auringonlasku_tai_nousu
NA	Jyv칛skyl칛	2010-03-22	"SUT: lle on l칛hetetty 24.3.2010 seuraavanlainen ilmoitus: 
Maanantaina 22.3 2010 ajelin py칬r칛ll칛 Keuruuntiet칛 klo 19.40 oli kiire kun saavuin siihen Myllyj칛rven kohdalle et칛isyytt칛 800m Keljon Prisman yl칛puolelta kaupungilta lensi lautasen n칛k칬inen esine josta tippui pieni kirkas pallo jok asammui pian. Lentokone se ei ollut. Lenti sinne Keljonlahdelle p칛in aika lujaa. Nyt on kuulemma alkanut kuulua outoa vinkunaa vesijohdoista. Onko kukaan muu n칛hnyt tai kuullut mit칛칛n?"	Ei	ei	ei	ei	ei	http://fufora.fi/ufodb/ufodata.php?u=322&p=1	62.2426034	25.7472567	kirkas p칛iv칛nvalo
NA	Kotka	2010-10-09	"Menin ulos tupakalle Big Brotherin mainoskatkolla. Meid칛n rappusilta n칛kee Haminaan p칛in. Valopalloja rupes lipumaan pohjosesta etel칛칛n just sill칛 haminan suunnalla. Okei, olin ihmeiss칛ni ja en osannu p칛칛tt칛칛 hakeako is칛 (makas tolkku poissa s칛ngyss칛) todistamaan vai menn칛k칬 rantaan kattomaan paremmin. P칛칛tin her칛tt칛칛 is칛n. Siin칛 meni 20 sekuntia. Hain ehk칛 siin칛 h칬t칛k칛ss칛 my칬s puhelimen ja rupesin soittamaan serkulle.  
Palasin ulos ja n칛in pallot edelleen. Jossain vaiheessa ne oli pys칛htynein칛 taivaalla. Mun is칛 n칛ki ne my칬s vaik ei j칛lkeenp칛"	Ei	ei	kyll칛	ei	kyll칛	http://fufora.fi/ufodb/ufodata.php?u=342&p=1	60.4665666	26.9459403	pime칛
NA	Helsinki	2012-11-24	캅ken olin tuolla taloyhti칬n pihalla Helsingin kalliossa, ja kiinnitin huomiota siihen kun taivalla lenteli todella paljon lokkeja, jotka kaikki kierteliv칛t keh칛칛, liiteliv칛t siell칛 sankoin joukoin. Sitten meni ohi lujaa kyyti칛 valtaisa parvi pikkulintuja. Pian t칛m칛n j칛lkeen n칛in taivaalla jonkun todella omituisen mustan pisteen, joka liikkui. Aluksi se n칛ytti tulevan kohti. Ajattelin ett칛 onko se meteoriitti. Hieman syke nousi. Mutta se ei l칛hentynyt sittenk칛칛n vaan jatkoi liikett칛칛n suoraan minun ylitseni, ja edelleen kerrostalon yli ja meneti	Ei	kyll칛	ei	NA	ei	http://fufora.fi/ufodb/ufodata.php?u=770&p=1	60.16985569999999	24.938379	kirkas p칛iv칛nvalo
http://www.suomenufotutkijat.fi/ufodb/_ufoimages/1017__1.jpg	Asikkala	2014-01-21	Katsoimme 17v-tytt칛reni kanssa makuuhuoneessa televisiota tiistaina 21.1.2014 hieman klo 18.00 j칛lkeen. Yht칛kki칛 molemmat havaitsivat kirkkaan, noin jalkapallon kokoisen, hieman sinert칛v칛t valopallon, mik칛 ik칛칛nkuin kaarsi korkealta viereisen varastorakennuksen ja tien yli vastap칛isen omakotitalon taakse tai takapellolle. Luulin ensin ett칛 n칛in harhoja, mutta kun tytt칛reni pari sekuntia t칛m칛n j칛lkeen kysyi minulta ett칛 mik칛 tuo oli, niin oli itsekin my칬nnett칛v칛, ett칛 totta se n칛ky oli. K칛vin kysym칛ss칛 muilta perheenj칛senilt칛 olikovatko he n칛hne	Kyll칛	ei	ei	ei	kyll칛	http://fufora.fi/ufodb/ufodata.php?u=1017&p=1	61.1721358	25.5471382	pime칛
NA	Posio	2011-03-31	31.3.2011 aamulla klo 5:40 havaitsimme yst칛v칛mme kanssa tunnistamattoman valo pallon taivaalla n. 1500 piirua taivaanrannan yl칛puolella pohjoisessa. 15 minuutin seurannan j칛lkeen valo liikkui taivaalla n. 250 piirua. Valoilmi칬 muistutti lentokoneen laskeutumisvaloa ja se n칛kkyi noin tunnin ajan kunnes aurinko nousi kokonaan taivaalle ja pilvet peittiv칛t kohteen.	Ei	ei	ei	ei	kyll칛	http://fufora.fi/ufodb/ufodata.php?u=429&p=1	66.1105895	28.1672013	auringonlasku_tai_nousu
NA	Pornainen	2013-04-02	"L칛hdin kotoani 8.20 ajoin Laukkosken sillan yli ja havaitsin  Jokim칛en koulun ja Anttilantien yll칛 vasemmalla,  pellon yl칛puolella oudon kirkkaan esineen joka v칛lkehti auringossa. Aluksi luulin sit칛 lentokoneeksi mutta tarkemmin katsottuna esine oli py칬re칛 n, 1 m halkaisija, jossa oli joka puolella tummat "" ulokkeet "". Esine py칬ri hitaasti ympyr칛칛 ja liikkui samalla  Helsingintien suuntaisesti kohti koulua ja jokea. Et칛isyys tielt칛 esineeseen on vaikea arvioida mutta n칛in ulokkeet selv칛sti ehk칛 matkaa 50 - 100 m. H칛mm칛stelin autosta asiaa mutta"	Ei	ei	ei	ei	kyll칛	http://fufora.fi/ufodb/ufodata.php?u=845&p=1	60.4758436	25.3749759	kirkas p칛iv칛nvalo
http://www.suomenufotutkijat.fi/ufodb/_ufoimages/420__1.jpg	Tampere	2011-03-23	N칛in korkealla n. 60 asteessa lent칛v칛n lieri칬m칛isen esineen.Esine oli matkustajakonetta suurempi 칛칛net칬n siit칛 ei j칛칛nyt vanaa,eik칛 siin칛 ollut siipien kaltaisia ulokkeita.Esine lensi koillisesta luoteeseen.	Kyll칛	ei	ei	ei	ei	http://fufora.fi/ufodb/ufodata.php?u=420&p=1	61.4977524	23.7609535	kirkas p칛iv칛nvalo
NA	Raisio	1954-09-01	Oltiin luokkaretkell칛 ja pidettiin taukoa pellon raunassa.  Metallinhohtoinen esine nousi spiraalinomaisesti yl칬s kunnes katosi. Esine oli py칬re칛. Ei vaikuttanut s칛칛pallolta. Se hohti  hopeanmetallinv칛risen칛 auringonvalossa. Nousi suhteellisen nopeasti vappuilmapallon nopeudella tehden laajaa spiraalimaista liikett칛.	Ei	ei	ei	ei	ei	http://fufora.fi/ufodb/ufodata.php?u=421&p=1	60.48591219999999	22.1689264	kirkas p칛iv칛nvalo
http://www.suomenufotutkijat.fi/ufodb/_ufoimages/625__1.jpg	Kouvola	2012-03-21	"Olin lapsieni ja is칛ni kanssa pihalla ulkoilemassa/leikkim칛ss칛, jossain vaiheessa huomasin t칛m칛n oudon ""vanan"" taivaalla. My칬s is칛ni huomasi saman ja ihmettelimme mik칛 mahtoi olla kyseess칛. Otin ensiksi k칛nnyk칛ll칛 kuvan, mutta sen ollessa niin huonolaatuinen, p칛칛tin hakea paremman kameran sis칛lt칛 ja napsia pari otosta ilmi칬st칛. 
K칛nnykk칛ll칛 otetussa kuvassa ilmi칬 n칛kyy heikosti, mutta sen vieress칛 vasemmalla n칛kyy suoraa vanaa pieni p칛tk칛. 
Ilmi칬 ei n칛kynyt kauaa, vaan peittyi pilvien taa."	Kyll칛	ei	ei	ei	ei	http://fufora.fi/ufodb/ufodata.php?u=625&p=1	60.8678835	26.7041601	kirkas p칛iv칛nvalo
NA	Tampere	2012-03-22	Havaitsin Treen l칛ntisell칛 taivaalla himme칛n t칛hden kaltaisen valopisteen liikkuvan, liian nopeasti ollakseen matkustajakone ja liian hitaasti ollakseen t칛hdenlento (meteoriitti). Noin kymmenen sekunttia sit칛 seurattuani se kirkastui 2-3 sek ajaksi kirkkaammaksi kuin t칛hdet ja himmeni sitten nopeasti h칛viten lopulta n칛kyvist칛. Koko tapahtuman aika oli noin 10-15 sek. Mit칛칛n kaupungin taustamelun ylitt칛v칛칛 칛칛nt칛 ei kuulunut. Valo ei vilkkunut, ainostaan loisti ensin himme칛mp칛n칛 ja kirkastui sitten ja himmeni taas h칛viten n칛kyvist칛. Nopeutta vois	Ei	ei	ei	ei	kyll칛	http://fufora.fi/ufodb/ufodata.php?u=624&p=1	61.4977524	23.7609535	pime칛
NA	Helsinki	2011-04-23	"Havaitsin taivaalla metallisen esineen, jota luulin aluksi lentokoneeksi, joskin se tuntui liikkuvan hyvin hitaasti tai pysyv칛n jopa paikallaan. Vaikka en ollut tarpeeksi l칛hell칛 n칛hd칛kseni esinett칛 kovin yksityiskohtaisesti, kiinnostuin siit칛, sill칛 se 칛kkikatsomalta omasi muodon, joka saattoi olla klassisen lent칛v칛n lautasen geometria.  
Huomasin pian esineen liikkuvan melko hitaasti vasemmalle, jolloin se muuttui hyvin kirkkaaksi keltaisesta valosta, mink칛 tulkitsin joko johtuvan auringonvalon heijastumisesta tai lentokoneen omista valonl칛ht"	Ei	ei	ei	ei	kyll칛	http://fufora.fi/ufodb/ufodata.php?u=445&p=1	60.16985569999999	24.938379	kirkas p칛iv칛nvalo
http://www.suomenufotutkijat.fi/ufodb/_ufoimages/280__1.JPG	Espoo	2010-05-22	(Sorry this is in English!) On Saturday, May 22 my husband called me outside to look at the clouds of a thunderstorm that passing north east of our house. At 16.05 I took a photo with our Canon Powershot SX200 (12 Mega pixels), I took a second photo from a different angle and zoomed in slightly. It is the second photo that I took, which has an object in it that we cannot explain. We didn't notice anything at the time I took the photo.	Kyll칛	ei	ei	NA	ei	http://fufora.fi/ufodb/ufodata.php?u=280&p=1	60.2054911	24.6559001	kirkas p칛iv칛nvalo
NA	Uusikaupunki	2010-05-20	"
Olin ulkoilemassa Uudenkaupungin etel칛puolisella ulkoilualueella 20.5.2010. 
Kalliolla maatessani osuin katsomaan taivaalle ja n칛in sauvanmuotoisen, 
auringon valoa kirkkaasti heijastavan kappaleen arviolta n. km korkeudessa. 
Taivas oli aivan pilvet칬n esineen lentokorkeudella. Esine pysytteli jonkin 
aikaa paikallaan ja eteni sitten kohti kaakkoa tehden nopeita sivuttaisia 
suunnanmuutoksia. Jonkin ajan kuluttua se palasi takaisin pysytellen jonkin 
aikaa yl칛puolellani ja katosi taas samaan suuntaan siksak-liikkeit칛 tehden. 
T칛m칛 toistui kolm"	Ei	ei	ei	ei	ei	http://fufora.fi/ufodb/ufodata.php?u=278&p=1	60.807601	21.402722	kirkas p칛iv칛nvalo
NA	vaasa	2014-05-20	kohteita oli monta	Ei	kyll칛	kyll칛	ei	kyll칛	http://fufora.fi/ufodb/ufodata.php?u=1069&p=1	63.09508899999999	21.6164564	h칛m칛r칛
http://www.suomenufotutkijat.fi/ufodb/_ufoimages/1082__1.jpg	Pori	2008-08-15	Olimme hyv칛n yst칛v칛ni kanssa kuvailemassa syksyist칛 auringonlaskua Porin Kallossa my칬h칛칛n illalla (aurinko laski muistaakseni n. klo 23 menness칛) v. 2008 (15.8. kameran datan perusteella). Kuvailimme jokusen tunnin siin칛 ja ilma oli maagisen upea. Jotain hy칬nteisi칛 taisi ilmassa olla, jos oikein muistan. Ainoat 칛칛net mit칛 kuulimme, olivat lintujen luomia ja sorsia tms lenteli v칛lill칛 matalalta ihan silmiemme edest칛. Emme omin silmin huomanneet mit칛칛n poikkeavaa taivaalla, ainoastaan kuvasatoa peratessani aloin kiinnitt칛칛 huomiota taivaalla olev	Kyll칛	ei	ei	NA	ei	http://fufora.fi/ufodb/ufodata.php?u=1082&p=1	61.4851393	21.7974178	auringonlasku_tai_nousu
http://www.suomenufotutkijat.fi/ufodb/_ufoimages/685__1.jpg	Vaasa	1976-07-01	"Suomalainen ei usko ennenkuin n칛kee.T칛m칛 ei unohdu koskaan. 
-Sota-aseita vain kehitell칛칛n ja kauhufilmit n칛ytet칛칛n jo pikkulapsille. Miss칛 on oikea rakkaus. 
-Uskaltaako kukaan kohta en칛칛n kertoa kokemuksiaan, jos niille vaan nauretaan. 
-Nyt on maailmassa tosi kysymyksess칛. 
-Maanj칛ristys.Tulivuoret yms. 
-Kuka meit칛 ja mik칛 vie!"	Kyll칛	kyll칛	kyll칛	ei	ei	http://fufora.fi/ufodb/ufodata.php?u=685&p=1	63.09508899999999	21.6164564	kirkas p칛iv칛nvalo
http://www.suomenufotutkijat.fi/ufodb/_ufoimages/1101__1.jpg	Hein칛vesi	2012-12-23	"Aloittelevana t칛htivalokuvaajana joskus tulee otettua ep칛onnistuneita kuvia, mutta n칛m칛 kuvat ovat j칛칛neet ihmetytt칛m칛칛n. 
Kuvat (3 kpl liitteen칛) on otettu 23.12.2012 klo 20:05 Hein칛vedell칛, valotusaika on varmaan jotain 10s luokkaa, en muista en칛칛. Huomasin yhden kuvan j칛lkeen, ett칛 seulasten ja kuun lis칛ksi kuvaan oli ilmestynyt muutakin, ja ajattelin sen olevan heijastus. Otin uuden kuvan samasta kohdasta, ja ihmetyksekseni kuvassa oli edelleen jotain kummallista. Muistan, ett칛 en paljaalla silm칛ll칛 n칛hnyt kuun ja seulasten v칛liss칛 mit칛칛n y"	Kyll칛	ei	ei	ei	ei	http://fufora.fi/ufodb/ufodata.php?u=1101&p=1	62.4228036	28.6317663	pime칛
http://www.suomenufotutkijat.fi/ufodb/_ufoimages/312__1.jpg	Turku	2010-06-07	"Olin viett칛m칛ss칛 vapaap칛iv칛칛 kaupungilla (Turussa) ja mukanani oli kamera. Vartiovuoren m칛ell칛 otin kaupunkikuvan Mikaelinkirkon suuntaan. Kotona tietokoneella huomasin kuvassa t칛pl칛n kirkontornista hieman oikealle kuvan yl칛laidassa. Zoomasin t칛pl칛칛n ja huomasin siin칛 olevan hopeisen n칛k칬isen lautasen mallisen kohteen. 
Toinen samana p칛iv칛n칛 ottamani kuva, jossa niinik칛칛 huomasin oudon kohteen vasta kotona koneella, oli otettu Kaskenkadulta suuntana Aurakatu ja sen p칛칛ss칛 oleva Turun Taidemuseo. Kuvassa taivaan siness칛 on outo kohde oikealla. T"	Kyll칛	ei	ei	NA	ei	http://fufora.fi/ufodb/ufodata.php?u=312&p=1	60.4518126	22.2666303	kirkas p칛iv칛nvalo
NA	kouvola	2013-08-23	Menin ulos tarkistamaan nukutaanko ylh칛칛ll칛,(lapset) eli n칛kyyk칬 ikkunasta valoa. Katsoin ikkunaa yl칬sp칛in, jolloin n칛in kirkkaan valon, kuin t칛hden  liikkuvan, seurasin katseella, valo liikui yl칛viistoon nopeudella joka olisi vastannut lentokonetta, mutta valo alkoi loitota/himmenty칛 nopeasti  , josta maallikkona p칛칛ttelin ettei se voi olla lentokone. valo oli my칬s kirkkaampi kuin lentokoneen eik칛 ainakaan punaista ollut yht칛칛n kuin yleens칛 lentokoneissa olen 칬isin n칛hnyt, eik칛 my칬sk칛칛n vilkkuvaa valoa. sitten valo siis katosi n칛kyvist칛, mit칛칛	Ei	ei	ei	ei	kyll칛	http://fufora.fi/ufodb/ufodata.php?u=928&p=1	60.8678835	26.7041601	pime칛
http://www.suomenufotutkijat.fi/ufodb/_ufoimages/323__1.jpg	Helsinki	2002-06-01	"
Istuin parvekkeella kahvilla, kun huomasin taivaalla oudon n칛k칬isen esineen. Se py칬ry pystyakselin ymp칛ri vastap칛iv칛칛n ja sen pohjassa n칛kyi punainen ja vihre칛 valo. Se lensi verkkaisesti py칬rien n칛k칬kent칛ss칛 vasemmalle alasp칛in ja katosi  naapuritalon sein칛n taakse. En uskaltanut l칛hte칛 hakemaan kiikaria tai kameraa koska pelk칛sin sen enn칛tt칛v칛n kadota. 
N칛in Discovery-kanavalta tulleessa ohjelmassa  UFO- jalat maassa- syyt칛 uskoa 춦 samanlaisen laitteen . Siit칛 oli lyhyt videop칛tk칛 ohjelman alkupuolella, mutta asiasta todettiin vain, ett칛 se"	Kyll칛	ei	ei	ei	ei	http://fufora.fi/ufodb/ufodata.php?u=323&p=1	60.16985569999999	24.938379	kirkas p칛iv칛nvalo
NA	inari	2012-09-21	N칛htiin kaverin kanssa pime칛ll칛 inarinj칛rvell칛 nopeasti liikkuva v칛lill칛 kirkkaasti hehkuva pallo.liikkui v칛lill칛 vaakaan ja siit칛 suoraan yl칬s ja alasp칛in.puoliminuuttia noin.nopeus oli k칛sitt칛m칛t칬n?oranssi himme칛 hehku j칛i joskus n칛kyviin kun vaihtoi suuntaa.v칛lill칛 katosi mutta tuli n칛kyviin aina uudestaan ja lopuksi katosi suoraan yl칬sp칛in.	Ei	kyll칛	kyll칛	ei	kyll칛	http://fufora.fi/ufodb/ufodata.php?u=732&p=1	68.9062035	27.0277551	pime칛
http://www.suomenufotutkijat.fi/ufodb/_ufoimages/144__1.JPG	ilomantsi	2009-09-26	26.9.2009 olimme avopuolisoni kanssa ilomantsissa talonvahtina vanhemmilleni, jotka olivat l칛hteneet hirven mets칛stykseen. L칛mmitimme rantasaunan. Saunoimme ja avopuolisoni p칛칛tti k칛yd칛 pulahtamassa lammessa uimassa, tapani mukaan l칛ksin mukaan laiturille ojentamaan h칛nelle pyyhett칛. Laiturilta saunallep칛in k칛velless칛mme avopuolisoni huomasi taivaalla jotakin sinne kuulumatonta ja huudahti minulle, ett칛 katso mik칛 tuo on! Suoraan otavan alapuolella n칛kyi hitaasti liikkuva objekti, joka emittoi voimakkaasti valkoista valoa. Objetkin kulku ja kul	Kyll칛	ei	ei	ei	kyll칛	http://fufora.fi/ufodb/ufodata.php?u=144&p=1	62.66788529999999	30.9394911	pime칛
http://www.suomenufotutkijat.fi/ufodb/_ufoimages/1166__1.jpg	Piikki칬	2014-02-14	"
Hei. L칛hetin vanhemman miehen 83v kameralla otetusta kuvasta tapahtuman 14.2.14 piikki칬ss칛. 30-50 lent칛v칛칛 meni ohi 3krs kerrostalolla ja kuului 칛칛ni kun tuulen suhina. Mit칛 t칛m칛 voisi olla. Ne my칬s h칛visiv칛t kuin olisi menny talliin. T칛n칛 kes칛n칛 mun muija n칛ki my칬s yhden Piikki칬n y칬taivaalla. Se oli korkealla. Piikki칬ss칛 on aiemmin n칛hty my칬s kirkkaalla p칛iv칛ll칛 samanlaisia, esim hallini yl칛puolella. Koko on ollut melko pieni. Mutta kohde on ollut kaukana my칬s. 14.2 meni l칛helt칛 ehk칛 noin 100m ja koko oli aika pieni, ehk칛 metri tai puoli. Tai"	Kyll칛	ei	ei	ei	ei	http://fufora.fi/ufodb/ufodata.php?u=1166&p=1	60.42633249999999	22.5232337	pime칛
NA	Pudasj칛rvi	2010-01-01	"Omakotitalon pihassa kulkiessa kiinnitin huomiota kirkkaaseen t칛hteen joka vilkkui harvakseltaan noin 5 kertaa t칛m칛n j칛lkeen ""t칛hti"" sammui. Hetken tarkkailtua alkoi ensimm칛isen t칛hden alapuolella (noin 3-4 sormen leveytt칛) vilkkua toinen ""t칛hti"" samalla tavalla kuin ensimm칛inen. T칛m칛n kohteen sammuttua kului hetki ja ilmestyi kolmas vilkuttaja ensimm칛isen tasolle, mutta noin kolme sormen leveytt칛 oikeaan, t칛m칛kin sammui lopuksi. Tuli tunne kuin olisi ollut kolme kohdetta jotka viestitteliv칛t toisilleen vilkuttelemalla valojaan."	Ei	ei	ei	ei	kyll칛	http://fufora.fi/ufodb/ufodata.php?u=384&p=1	65.36185329999999	26.985855	pime칛
http://www.suomenufotutkijat.fi/ufodb/_ufoimages/383__1.JPG	Loppi/Pilpala	2011-01-13	"Anoppi otti valokuvia uudesta asunnosta, huomasimme kuvassa oudon pienen n칛k칬isen ""olennon"" (tuolinvieress칛 lattialla) Otimme n.5 kuvaa 3 kuvassa n칛kyi olento ja kahdessa viimeisess칛 ei n칛kynyt mit칛칛n. 
Kiinnostaa teid칛n mielipiteenne, milt칛 kuvat teist칛 n칛ytt칛칛?"	Kyll칛	ei	ei	NA	ei	http://fufora.fi/ufodb/ufodata.php?u=383&p=1	60.6230594	24.2872299	pime칛
NA	Turku	2014-12-24	N칛in aiemmin t칛n칛 iltana (24.12) noin klo 23 ehk칛 noin viisi valoa taivaalla kotini parvekkeelta , jotka liikkuivat h칬yhenen kevyesti toistensa lomassa ja katosivat sitten n칛kyvist칛ni.	Ei	kyll칛	ei	ei	kyll칛	http://fufora.fi/ufodb/ufodata.php?u=1173&p=1	60.4518126	22.2666303	pime칛
NA	Vihti	2009-04-20	Mies Vihdin Nummelasta kertoi n칛kev칛ns칛 ufoja y칬 kello 24 paikkeilla.	Ei	ei	ei	ei	ei	http://fufora.fi/ufodb/ufodata.php?u=65&p=1	60.4165735	24.3256379	kirkas p칛iv칛nvalo
NA	Hartola	2011-04-22	"Viime pitk칛perjantaina olin 칛itini luona Hartolan Koitissa k칛ym칛ss칛 yst칛v칛ni kanssa. Nukuimme rantasaunassa, josta on selke칛 n칛kym칛 j칛rvelle. Keskustelimme my칬h칛칛n y칬h칬n. Noin klo. 23 n칛in j칛rven toisella puolella olevan mets칛n takaa nousevan hyvin kirkkaan esineen. Aluksi luulin sen olevan t칛hti, sen j칛lkeen lentokone. Tajutessani, ettei se voinut olla kumpikaan sanoin yst칛v칛lleni:"" Mik칛 tuo on?"" H칛n ei osannut sanoa. Kohde nousi portaittain yl칬s kovaa vauhtia. Menin ulos kuunnellakseni sit칛. Siit칛 ei l칛htenyt mit칛칛n 칛칛nt칛. Jos se olisi ollut "	Ei	kyll칛	ei	kyll칛	kyll칛	http://fufora.fi/ufodb/ufodata.php?u=451&p=1	61.57981379999999	26.0201798	pime칛
NA	Liminka	2011-05-02	"N칛in kirkkaan valopisteen taivaalla joka liikkui tasaisesti eteen p칛in himmeten koko ajan kunnes katosi n칛kyvist칛. Hetken p칛칛st칛 se ilmestyi et칛칛mp칛n칛 n칛kyviin jolloin kolme kaverianikin n칛ki sen jo. Se hengasi aluksi Otavan l칛hettyvill칛 l칛htien liikkumaan vilkkuen ep칛tasaiseen tahtiin, n칛kyi vain vilkkuessa. Vilkkui v칛lill칛 kirkkaasti ja nopeasti, v칛lill칛 kadoten n칛kyvist칛 pitemm칛ksi aikaa, ja vilkkumisen kirkkaus vaihteli. Liikkumisrata oli mutkitteleva ja vaihteleva, poukkoileva. Menness칛칛n kauemmas ""hypyt"" lyheniv칛t ja lopulta n칛ytti ett칛 k"	Ei	ei	kyll칛	ei	kyll칛	http://fufora.fi/ufodb/ufodata.php?u=450&p=1	64.80983069999999	25.4153328	pime칛
NA	Kurikka	2012-05-01	"Ensiksi haluan sanoa, ett칛 olen aina ollut skeptikko n칛itten asioitten suhteen, mutta kokemus muutti k칛sitykseni. N칛in jotain jota en pysty ymm칛rt칛m칛칛n. Ja vaikka oli vappup칛iv칛 niin alkoholilla ei ole osuutta t칛h칛n. En ollut maistanut tippaakaan koko vappuna. 
Olin ulkona kotipihalla ja eteeni ilmestyi n. 30 cm pitk칛 valokoisena leijuva kirkas kuin ameeba tai vastaava liikkuen. Sain seurata sit칛 jonkin aikaa ja mietin mik칛 voisi t칛h칛n aikaan vuodesta olla sellainen joka voisi tuulessa leijua. Seurasin sit칛 kunnes se katosi puitten taakse ja ol"	Ei	ei	kyll칛	ei	kyll칛	http://fufora.fi/ufodb/ufodata.php?u=651&p=1	62.6171324	22.3987049	kirkas p칛iv칛nvalo
NA	K칛rk칬l칛	2014-04-26	Parina iltana huhtikuun lopulla n칛in outoja valoja taivaalla. Etel칛st칛 liikkui hitaasti ensin yksi valopiste pohjoiseen, sitten ilmestyi toinen piste joka my칬s liikkui hitaasti. Valot eiv칛t vilkkuneet eik칛 niiden voimakkuus muuttunut silminn칛ht칛v칛sti. Et칛isyytt칛 oli vaikea arvioida, korkeus oli juuri puun latvojen yl칛puolella. Mit칛칛n 칛칛nt칛 ei kuulunut. Jonkin aikaa liikuttuaan valot pys칛htyiv칛t ja olivat paikoillaan, sitten toinen l칛hti takaisin samaan suuntaan mist칛 tuli ja toinen nousi pystysuoraan yl칬sp칛in. Noustuaan jonkin aikaa hitaasti va	Ei	kyll칛	kyll칛	ei	kyll칛	http://fufora.fi/ufodb/ufodata.php?u=1057&p=1	60.86887770000001	25.2773703	pime칛
http://www.suomenufotutkijat.fi/ufodb/_ufoimages/1058__1.jpg	Sein칛joen kaupunki	1971-06-01	"Pekka Liimatainen oli tavannut Juha Hannulan vuoden 2014 alussa Helsingin Malmin Hare Krishna-temppeliss칛. 
Pekka oli kirjoittanut muistiin Juhan kertomuksen: 
"" Juha Hannula oli Sein칛joen Kaupungissa 5- vuotiaana Joupin kaupunginosassa 1971 ja 1972 hoitolapsena 40-50 vuotiaan t칛din hoidossa. Alkukes칛n aikana h칛n joutui kokemaan itseens칛 kohdistuvan iskun,jonka j칛lkeen esine hajosi kahdeksi kappaleeksi. 
Tilanne oli pys칛htynyt tunnelma. Se tuli katkoviivaa pitkin ja t칬rm칛si henkil칬칬n, joka rupesi itkem칛칛n. T칛ti tuli h칛nen luokseen ja sanoi, ett"	Kyll칛	ei	ei	ei	ei	http://fufora.fi/ufodb/ufodata.php?u=1058&p=1	62.787735	22.8504337	kirkas p칛iv칛nvalo
http://www.suomenufotutkijat.fi/ufodb/_ufoimages/234__1.JPG	Espoo	2010-02-08	"
Ennen havaintoa ( 2 p칛iv칛칛 )  
Sitten t칛m칛 valopallo- havainto bussin ikkunasta kotimatkalla. Lumeen j칛칛 punainen j칛lki  merkiksi 춦 . Otan siit칛 n칛ytteen ja luovutan sen ufotutkijoille. Otan seuraavana p칛iv칛n칛 pari valokuvaa ristist칛, joka siis on edelleen lumessa. Silloin kameran laukaisin 춦 reistailee 춦, eik칛 5:een sekuntiin suostu painumaan alas. 
Matkalla havaintopaikalle n칛ytteit칛 ottamaan taivaalla vilahtaa  
( samainen ) valopallo kovaa vauhtia ( 2000 km/h )  yl칬sp칛in vinosti. 
My칬hemmin parin p칛iv칛n p칛칛st칛 palaan ufon havaintopaikalle"	Kyll칛	kyll칛	kyll칛	ei	kyll칛	http://fufora.fi/ufodb/ufodata.php?u=234&p=1	60.2054911	24.6559001	kirkas p칛iv칛nvalo
http://www.suomenufotutkijat.fi/ufodb/_ufoimages/422__1.jpg	Porkkala	2000-07-01	"
Lep칛ilin veneen kannella. Katselin sinitaivasta. Huomasin "" alumiinipallon "" l칛hestyv칛n etel칛st칛.  
( keskip칛iv칛 noin ). TUNTUI LUONNOLLISELTA verrata 10 km korkeudella lent칛v칛칛n matkustajakoneeseen ? 
Korkeutta en osaa sanoa, koska koko ei muuttunut havainnon aikana? Olisiko siis ollut 100 km ?? 
Tuli kuin JUNA! 
Suihkari jos oli 10 km, lentonopeus oli noin 2-3 kertainen suihkukoneeseen verraten. Halkaisija t칛ll칬in n. 50- 70 metri칛- suurempi kuin lentokoneen siivenk칛rkien v칛li. 
Lento oli 칛칛net칬n ja 30- 50 sek. kest칛v칛 . Pys칛htyi sekunniksi, "	Kyll칛	ei	kyll칛	ei	ei	http://fufora.fi/ufodb/ufodata.php?u=422&p=1	59.987545	24.4303004	kirkas p칛iv칛nvalo
NA	sastamala	2012-03-22	Taivaalle ilmaantui kirkkaanvihre칛 valo, se laskeui melko hitaasti alasp칛in, muistuttaen hieman h칛t칛rakettia. Sitten se n칛ytti katoavan pilven taakse. S칛칛 oli kuitenkin kirkas ja taivaalla ei muuten n칛kynyt pilvi칛, vain silloin kun vihre칛 valo laskeuti sen alapuolella n칛kyi sumupilvi jonka taakse valo katosi.	Ei	ei	ei	NA	kyll칛	http://fufora.fi/ufodb/ufodata.php?u=627&p=1	61.3376032	22.9184987	pime칛
NA	Jyv칛skyl칛	2011-04-24	"Rivitalon takapihalla ollessani j-kyl칛ss칛 toukotiell칛 n. klo 23.40 huomasin liikett칛 silm칛kulmassani, ja kun siirsin katseeni ylemm칛s, n칛in kirkkaan vihre칛n valon, muttei se h칛ik칛issyt kumminkaan, liikkuvan pohjois etel칛 suuntaan taivaalla. N칛ytti silt칛 kuin se olisi v칛hent칛nyt korkeutta muttei kuitenkaan pudonnut, putoaminen olisi ollut hitaampaa,valo oli todella vihre칛칛, melkein turkoosia ja sen reunat olivat sini punaiset,kaksi juuri ja juuri toisistaan eroittuvaa soikean muotoista valoa,todella s칛칛nn칬lliset eiv칛tk칛 mill칛칛nlailla ""suihkunnee"	Ei	ei	ei	kyll칛	kyll칛	http://fufora.fi/ufodb/ufodata.php?u=446&p=1	62.2426034	25.7472567	pime칛
