kuva1	Kunta tai kaupunki	P칛iv칛m칛칛r칛	kuvaus	havaintokuvat	Aiheuttiko kohde pelkoa	Pys칛htyik칬 kohde	Ilmoitko havainnostasi sanomalehdille tai viranomaisille	Loistiko kohde valoa	URL	Lat	Lon	Valoisuus
http://www.suomenufotutkijat.fi/ufodb/_ufoimages/88__1.jpg	Tohmaj칛rvi	2008-12-27	"Olen seurannut kahden tunnistamattoman objektin liikkeit칛 t칛n칛 talvena ja kev칛칛n칛 alkaen 27.12.2008 - 1.6.2009. Olen tehnyt niist칛 tiivistelm칛t YouTubeen aiheella 
Onkamo 
http://www.youtube.com/profile?user=sismaria37&view=videos 
Yhdess칛 otoksessa minulla on ulkopuolinen mieshenkil칬 katsomassa objektia ja h칛n ep칛ili sit칛 satelliitiksi. Tuntuu, ett칛 objekti reagoi tarkkailuun ja jopa puheeseen (testasin sit칛 tuttavallisesti monin tavoin) ja my칬s muita oireita ilmaantui (ihottuma vasempaan k칛teen ja l칛mm칬n tunteita siin칛, kameraan tallentui lii"	Kyll칛	ei	ei	ei	kyll칛	http://fufora.fi/ufodb/ufodata.php?u=88&p=1	62.2251709	30.3353905	h칛m칛r칛
NA	helsinki 70	1964-04-01	oli luminen kev渴,p먞맙i말sloma koulusta ja hiihdin yksin l맏eisell pellolla.tuli outo tunne:pienen tytt쑕 en ymmrt맕yt viel kyseist tilaa.katseeni kohdistui taivaalle:oli outoja valoviivoja,4 kappaletta,jotka seurasivat joka liikett맕i;hiihdin eteenp말n ja viivat taivaalla kulkivat kuin heijastuksena samaan suuntaan,mutta,kun k먞맕nyin.nekin muuttivat suuntaa ja kulkivat taas yl맗uolellani.pel맙tyin ja pakenin kotiin.	Ei	kyll칛	kyll칛	ei	kyll칛	http://fufora.fi/ufodb/ufodata.php?u=96&p=1	60.247528	24.862123	kirkas p칛iv칛nvalo
http://www.suomenufotutkijat.fi/ufodb/_ufoimages/102__1.jpg	Nurmij칛rvi	2009-05-30	Olin l칛hd칬ss칛 30.5. lauantaina Klaukkalan Lidl kaupasta Luukin ulkoilualueelle. Ajettuani hetken Lahnuksentiet칛 huomasin taivaalla tumman esineen, jota pidin ensin suoraan edest칛 tulevana helikopterina ja pys칛hdyin tienvarteen katsomaan sit칛. Tarkkailin esinett칛 auton avoimesta ikkunasta. Kohde  joka oli ensin n칛ytt칛nyt helikopterilta ei kuitenkaan liikkunut minnekk칛칛n eik칛 siit칛 ei l칛htenyt mit칛칛n 칛칛nt칛. En my칬sk칛칛n n칛hnyt  mit칛칛n ulokkeita kuten siipi칛 roottoria tai potkuria. Tarkkailin kohdetta n. 5 minuuttia ja se oli koko ajan samassa paik	Kyll칛	ei	kyll칛	ei	ei	http://fufora.fi/ufodb/ufodata.php?u=102&p=1	60.4654987	24.8071756	kirkas p칛iv칛nvalo
NA	ylivieska	2009-08-07	"7.8 2009 klo 01:55-02 istuin potrailla tupakoimassa selvinp칛in! 
kuu ja sen alla jupiter olivat n칛kyviss칛 koska taivas oli kirkas mutta en n칛hnyt kyseisi칛 taivaankappaleita suoraan siihen miss칛 istuin 
kun yht칛kki칛 vasemmalta noin kuun korkeudella ,asteista en tied칛 valkoinen ""valo"" lensi vasemmalta oikealle h칛viten oikealle ,kohde lensi t칛ysin vaakatasossa ja oli kirkkaudeltaan l칛hes venuksen luokkaa paitsi valo oli erilaista tasaista ja kummallista,nopeudesta en voi sanoa mit칛칛n kun en tied칛 et칛isyytt칛 mutta n칛in t칛m칛n jutskan noin 10 sekunti"	Ei	ei	ei	ei	kyll칛	http://fufora.fi/ufodb/ufodata.php?u=104&p=1	64.07234199999999	24.5335825	pime칛
NA	Tampere	2009-08-10	"Hei, 
Olimme eilen yst칛v칛ni kanssa Tampereella N칛sinkalliolla istuskelemassa yhdenaikaan sunnuntai-maanantai y칬ll칛 kunnes havaitsimme l칛nnest칛 kirkkaan, puna-keltaisen suuren valopallon, joka ilmestyi taivaalle yht칛kki칛 ja katosi harjun taakse n칛k칬kent칛st칛mme. Pallo oli 칛칛net칬n eik칛 sen per칛ss칛 ollut mink칛칛nlaista pyrst칬칛. Se laskeutui suhteellisen loivassa kulmassa nopeahkolla vauhdilla, eik칛 ollut n칛k칬kent칛ss칛mme kuin vajaan 10 sekuntia. Mit칛칛n loogista selityst칛 emme ole keksineet, sill칛 kyseisess칛 paikassa ei ole lentokoneliikennett칛 niin m"	Ei	ei	ei	ei	kyll칛	http://fufora.fi/ufodb/ufodata.php?u=107&p=1	61.4977524	23.7609535	pime칛
NA	Oulu	2009-08-23	Olen aina ollut kiinnostunut t칛htitaivaasta ja sen ilmi칬ist칛. Luonnollisestikin talvisin mutta my칬s n칛in syksyisin tapanani on iltaisin ja 칬isin menn칛 ulos ja ihailla t칛htitaivasta s칛칛n salliessa. Oma havaintoni sattui 23. elokuuta 2009 noin kello 01.35. Olin kotonani(n.20km Oulun keskustasta),vuonna 1964 valmistuneen omakotitalon yl칛kerrassa katsomassa televisiota, kun p칛칛tin menn칛 alakerran keitti칬칬n. Kulkiessani parvekkeen (sijaitsee talon 2krs.etel칛p칛칛dyss칛) ikkunallisen oven vieritse totesin t칛htitaivaan n칛kyv칛n hienosti. P칛칛tin piipahtaa 	Ei	ei	ei	ei	kyll칛	http://fufora.fi/ufodb/ufodata.php?u=111&p=1	65.0120888	25.4650773	pime칛
NA	Paltamo	2009-08-21	"Olimme viime viikonloppuna m칬kill칛 Kainuussa Ouluj칛rven yl칛puolella 
ja valvoimme my칬h칛칛n perjantai-iltana, jolloin havaitsimme m칬kkimme yl칛puolella kirkkaalla t칛htitaivaalla nopeasti liikkuvia valopalloja, 
joita aluksi luulimme satelliiteiksi. Niit칛 tuli eri suunnista ja ne  
meniv칛t tosi kovaa taivaankannen yli. Er칛s niist칛 muutti kesken lennon 
suuntaansa ja alkoi sen j칛lkeen tekem칛칛n siksakkia. N칛imme my칬s ns. nopean t칛hdenlennon, joka sammui melkein samantien. En tied칛 satelliittien nopeuksia ja kirkkautta, joten en voi varmasti tiet칛칛, 
"	Ei	ei	ei	ei	kyll칛	http://fufora.fi/ufodb/ufodata.php?u=112&p=1	64.403043	27.8381469	pime칛
NA	Oulainen	2009-08-23	Olin jutellut mieheni kanssa tietokoneella lauantai-iltana jo useamman tunnin web-kamerat auki. Ajoittain kiinnitin huomiota 칛칛neen, joka oli h칛mment칛v칛n voimakas ajan ollessa jo kuitenkin yli puolen y칬n ja 칛칛nen l칛hde jossain rivitalo alueen ymp칛rist칬ss칛. 컊밡i kuulosti merkilliselt칛 sekoitukselta kaatosadetta peltikattoon,pesukoneen linkous-ohjelmaa, sek칛 matalalla lent칛v칛칛 helikopteria. Jossain vaiheessa jopa mieheni kysyi mik칛 ihme tuo kummallinen hurina on, jota on kest칛nyt jo tuntikausia..En siis kiinnitt칛nyt siihen niin suurta huomiota, e	Ei	kyll칛	ei	ei	kyll칛	http://fufora.fi/ufodb/ufodata.php?u=115&p=1	64.26761560000001	24.8159482	pime칛
NA	Pori	1979-10-01	"Ulkoilutin illalla joskus loka-marraskuussa 1979 (tai 1980) koiraani Porin Teknillisen Oppilaitoksen asuntolan (Tekunkorpi)l칛heisell칛 niityll칛, kun l칛heisen voimalinjan yl칛puolelle ilmestyi valtava, sikarinmuotoinen alus. 
Siit칛 leijaili valopallo korkeaj칛nnitepiuhoihin ja se sykki siin칛 aikansa aina vain valoisammaksi k칛yden. Lopulta se singahti vauhdilla em칛alukseen, joka samoin katosi valtavalla kiihtyvyydell칛 lounaistivaalle. 
Alueelta katkesivat s칛hk칬t noin tunniksi. 
Paikallislehdess칛 oli seuraavala viikolla maininta siit칛, ett칛 oli ollut"	Ei	kyll칛	kyll칛	ei	kyll칛	http://fufora.fi/ufodb/ufodata.php?u=116&p=1	61.4851393	21.7974178	h칛m칛r칛
NA	M칛ntyharju	2009-09-14	"Kaveri soitti, ett칛 h칛nen takkinsa j칛i autoon ja h칛n on tulossa hakemaan sit칛, ett칛 h칛n on kohta pihassa ja pit칛isi pihalle menn칛. Menin ulos ja kaveria ei n칛y miss칛칛. Aukaisin auton ovet istahdin autoo odottelemaan kaveria, joten j칛tin auton oven apposen auki. Oli t칛htikirkas taivas niin siin칛 odetellessa katselin taivaalle jos n칛kyis t칛hdenlentoja tai vastaavaa. Mets칛rajan takaa silmiin pisti taivaalla jokin huomattavasti normi t칛hti칛 isompi ""m칬tk칛le"", mutta kuitenkin kuuta pienempi..se oli reunuksilta puna oranssi ja keskelt칛 tummempi tai me"	Ei	ei	ei	ei	kyll칛	http://fufora.fi/ufodb/ufodata.php?u=121&p=1	61.41761330000001	26.8805117	pime칛
NA	Espoo	2009-09-20	"Tapahtuma kestoltaan noin viisi sekuntia. Kananmunaa hieman keskelt칛 kapeampi, soikion muotoinen, kirkas valopallo lensi noin 10-15 asteen kulmassa alhaalta yl칬sp칛in sammuen yll칛tt칛en. Olimme koiran kanssa iltalenkill칛 yhdess칛 poikayst칛v칛ni kanssa joka h칛nkin my칬s n칛ki tapahtuman. T칛ysin 칛칛net칬n, eik칛 j칛tt칛nyt mink칛칛nlaista vanaa taakseen. Olimme Espoon Mikkel칛ss칛 ja kello oli 20.55 21.9.09 
ohessa karttalinkki: 
http://alturl.com/8ibj"	Ei	kyll칛	ei	ei	kyll칛	http://fufora.fi/ufodb/ufodata.php?u=125&p=1	60.2054911	24.6559001	h칛m칛r칛
NA	Espoo	2009-09-27	Olimme 27.9.2009 espoonkeskuksessa,er칛칛n ruotsinkielisen koulun pihalla yst칛v칛ni kanssa katsomassa t칛htitaivasta. Makoilimme asvaltilla,ensin n칛in tavallisen eritt칛in nopean t칛hdenlennon,olen n칛hnyt useita t칛hdenlentoja el칛mni aikana. Hetke칛 my칬hemmin tarkalleen noin 00.32 havaitsin nopeaa liikkuvan kohteen joka n칛ytti keltaiselta t칛hdelt칛. Kohde liikkui eritt칛in nopeasti pitk칛n matkan ja katosi v칛lill칛 pilviin mutta tuli esiin nopeasti uudelleen,kohde ei pys칛htynyt mutta teki pienen liikkeen jota mik칛칛n tuntemani laite voi tehd칛. Vieress칛 maik	Ei	ei	ei	ei	kyll칛	http://fufora.fi/ufodb/ufodata.php?u=127&p=1	60.2054911	24.6559001	pime칛
NA	Raahe	2009-09-26	"(26.09.2009) 
Olimme porukalla kokoontunut yst칛v칛lle ottamaan muutamat oluet. Kun olin muutaman yst칛v칛n kera pihalla n칛in jotain uskomatonta ja huikkasin yst칛ville ett칛 mik칛 ihme tuo on ja he olivat niin sanotusti sanattomia, toki sielt칛 jokunen kirosana/puhetta kuului mutta on hankala kuvailla tapahtunutta, mutta aluksi mit칛 n칛in olisi voinut sanoa valopalloksi. Kello oli noin 23:00 ja tapahtumaa/lentely칛 kesti noin kello 00:30 asti, mutta kaikki aluksi luulivat ett칛 puhumme paskaa/huumoria, kaikki muuttui kun he olivat pihalla ja n칛in 5 valop"	Ei	ei	ei	ei	kyll칛	http://fufora.fi/ufodb/ufodata.php?u=132&p=1	64.6839541	24.4883649	pime칛
NA	Korpilahti	2009-09-20	"Menin ulos ja ihmettelin onko pohjant칛hti vinksahtanut paikoiltaan kun kovin kirkas t칛hti oli etel칛taivaalla. Hain kiikarit ja ajattelin niill칛 katsoa ja hetken katseltuani havaitsin tuon ""t칛hden"" liikkuvan. Hissukseen se valoilmi칬 l칛heni ja kiikareilla havaitsin sen tultua riitt칛v칛n l칛helle, ett칛 se oli joko soikea lieri칬 tai lautasen muotoinen jonka ulkokeh칛ll칛 oli tasaisin v칛lein kirkaita ""lamppuja"" keh칛ss칛. N칛iden valojen sis칛puolelta havaitsin vihre칛n ja punaisen himme칛mm칛n valon. Nuo v칛rit toivat mieleeni veneen kulkuvalot, mutta ei kait "	Ei	ei	kyll칛	ei	kyll칛	http://fufora.fi/ufodb/ufodata.php?u=133&p=1	62.0209932	25.5717816	pime칛
NA	kouvola	1993-08-16	olin armeijassa vartio palvelua suorittamassa.katselin tainasta ja etsin sielta pohjan t칛hte칛 ja otavan t칛htikuviota ja aloin ihmettelem칛칛n,kun huomasin taivaalla oudon kirkkaan ja liikkuvan valon.seurasin sit칛 ja huomasin sen liikkuva oudosti.se liikkui edestakaisin ja sitten se pys칛htyi ja j칛i paikalleen jonka j칛lkeen se katosi.sama ilmi칬 tapahtui my칬s seuraavana y칬n칛.	Ei	kyll칛	ei	ei	kyll칛	http://fufora.fi/ufodb/ufodata.php?u=136&p=1	60.8678835	26.7041601	pime칛
NA	tammela	1976-01-01	vuosi taisi olla -76,syyskuuta,kun olin tarkkailemassa t칛hti칛,paikka kunta tammela,kun yll칛tt칛en,l칛nnen suunnasta tuli horisonttiin kirkas punainen valopallo,ollen paikallaan hetken ja l칛htien sitten etel칛n suuntaan kadoten jonkun ajan kuluttua,oli paikallisessa lehdess칛kin juttua,eli muutkin havainneet. olisin kiitollinen tiedoista,kuka muu on n칛hnyt ja mit칛? vanha harrastus alkanut kiinnostaa taas.	Ei	ei	kyll칛	ei	kyll칛	http://fufora.fi/ufodb/ufodata.php?u=151&p=1	60.8090904	23.7690029	pime칛
NA	Kuopio	1983-01-01	Olin toimistoalan koulutuksessa Kuopiossa 1982-1983. Asuin poikani (s.1979) kanssa S칛rkiniementiell칛 opiskelija-asuntolassa. Vein joka aamu poikani perhep칛iv칛hoitoon Kuopion keskustassa asuvalle hoitajalle. Kuljimme bussilla. Nousimme aina bussiin S칛rkinimentien p칛칛ss칛 olevalta p칛칛tepys칛kilt칛. Bussi oli joka aamu p칛칛tepys칛kill칛, kun menimme sinne. Er칛칛n칛 talviaaamuna k칛velless칛mme poikani kanssa pys칛kki칛 kohti huomasin, ettei bussi olekaan p칛칛tt칛rill칛. Ja samassa huomasin tien p칛칛ss칛 mets칛ss칛 valon. Mit칛칛n 칛칛nt칛 ei kuitenkaan kuulunut. Poikani 	Ei	ei	kyll칛	ei	kyll칛	http://fufora.fi/ufodb/ufodata.php?u=173&p=1	62.89796999999999	27.6781725	pime칛
NA	Kirkkonummi	1986-01-01	Seuraava tapaus sattui jo kauan sitten ja se on j칛칛nyt l칛htem칛tt칬m칛sti mieleeni. Kun keskustelin siit칛 j칛lleen veljeni kanssa eilen, tuli mieleen, ett칛 asian voisi viimein mys칬s raportoida. Silloin nuorena raportointi ei jostain syyst칛 tuntunut tarpeelliselta enk칛 oikein tiennyt miten sen olisi voinut tehd칛k칛칛n. Olen harrastanut nuoruudesta saakka retkeily칛. Olin 80-luvun alkupuolella veljeni ja er칛칛n partiokaverin kanssa retkell칛 Kirkkonummella siihen aikaan partiolaisten suosimalla Korsolammen alueella. Oli kylm칛 vuodenaika, ehk칛 syystalvi ta	Ei	ei	kyll칛	ei	kyll칛	http://fufora.fi/ufodb/ufodata.php?u=174&p=1	60.12349320000001	24.4412965	pime칛
NA	Kuusankoski	2003-01-01	Olen nyt 17-vuotias ja olen nuoruudessani ollut hyvin kiinnostunut rajatiedosta. Kiinnostukseni alkoi noin 10-vuoden i칛ss칛, kun serkkuni luki minulle uforaporttia. Lainailin my칬s paljon kirjastosta tietoa mm. ufosieppauksista. Er칛s merkitt칛v칛 juttu tapahtui Kuusankoskella asuessani vuonna 2003. Olin tuolloin 11-vuotias. Lainailin kirjastosta paljon ufokirjoja ja hyvin kiinnostunut asiasta. Er칛칛n칛 talviy칬n칛 her칛sin n. 2-3 aikaan voimakkaaseen tunteeseen ja k칛칛nnyin toiselle kyljelleni. Nukuin pikkuveljeni kanssa kerross칛ngyss칛 ja min칛 nukuin yl칛	Ei	ei	ei	NA	ei	http://fufora.fi/ufodb/ufodata.php?u=187&p=1	60.9070054	26.6243343	kirkas p칛iv칛nvalo
NA	Joensuu	2009-12-13	"13.12 n. klo 5.40 olin l칛hd칬ss칛 yst칛v칛ni luota kotiin. Olin puhdistamassa ja laittamassa autoa k칛yntiin, kunhavaitsin tien toisella puolella olevan kirkon yl칛puolella valopallon jonka liikkui kieppuen ja jatkoi matkaansa kohti koveron suuntaan.Ajattelin ensin sen olleen lentokone, muttei kohteen sumumaisuus sovi lentokoneeseen ja kieppuva liikerata. 
L칛hdin autolla ajamaan kotiin, jonne on matkaa viitisen kilometri칛 ja puolessa v칛lin matkaa havaitsin tiell칛 ja ymp칛rist칬ss칛 valtavan valopylv칛칛n, joka hehkui punaista ja n칛ytti tulipalolta. Luulin"	Ei	kyll칛	ei	NA	kyll칛	http://fufora.fi/ufodb/ufodata.php?u=189&p=1	62.6010155	29.7635719	pime칛
NA	Kouvola	2009-12-17	"
17.12.09 n.klo 12:40 n칛in jossain kohtaa (en osaa tarkemmin sanoa,ei ole minulle kovinkaan tuttua aluetta) Elim칛en ja Anjalan v칛liss칛 kirkkaan valopilkun,joka oli hetken kuluttua tullut selv칛piirteisemm칛ksi.Se oli selv칛 lautasenmuotoinen esine,joka nyt hohti hopean v칛risen칛.Esine lipui tasaista vauhtia n. 100 m korkeudella mets칛n yl칛puolella,minusta n. 2 km p칛칛ss칛 oikealla sivulla.Er칛칛ss칛 kohdassa n칛ytti kuin alus olisi pys칛htynyt.Ehdin seurata alusta n. 5 km ajan,kunnes se muuttui pikkuhiljaa mustaksi/tummaksi,enk칛 voinut tarkkaan alusta en칛칛"	Ei	kyll칛	kyll칛	ei	kyll칛	http://fufora.fi/ufodb/ufodata.php?u=191&p=1	60.8678835	26.7041601	kirkas p칛iv칛nvalo
NA	Joensuu	2009-12-25	Olimme avovaimoni ja koiramme kanssa k칛velyll칛 Uskalj칛rven pohjoisp칛칛ss칛 j칛칛ll칛 Joulup칛iv칛n칛 noin kello 11.30-12.00. Ilma oli aurinkoinen ja ulkona oli pakkasta -23 astetta. Taivas oli pilvet칬n. Koiramme juoksenteli tuuttuun tapaan edell칛 ja suuntasi kohti rantaa. L칛hell칛 rantaa noin 20 metrin p칛칛ss칛 koira pys칛htyi. Koska meill칛 oli et칛isyytt칛 koiraan noin 30 metri칛, kutsuin koiraa nimelt칛 tulemaan luokse. Levitin k칛det samalla sivulle tehostaakseni kutsua. Koira l칛hti v칛litt칬m칛sti juoksemaan meit칛 kohti. Kuitenkin juostuaan noin 5 metri칛 koira	Ei	ei	ei	ei	kyll칛	http://fufora.fi/ufodb/ufodata.php?u=199&p=1	62.6010155	29.7635719	kirkas p칛iv칛nvalo
NA	Turku	2010-01-03	Olin 03.01.2010 n. klo 02.00 kotonani r칬칬kill칛 ulko-portaissa kun n칛in Turun sataman yl칛puolella tai merell칛 kauempana valo-ilmi칬n, jota aluksi luulin lentokoneeksi, koska siin칛 oli samanlaisia vilkkuvia huomiovaloja, joika lentokoneilla on. N칛ytti, ett칛 se tulee kohti, koska ulommaiset vilkkuvat valot n칛ytti lentokoneen siipivaloilta, jotka olivat kaukana toisistaan muilta keskinm칛isilt칛 vilkuvilta ryp칛levaloilta. Kiinnostukseni kuitenkin nousi, kun se alkoi liikkumaan sivuttain ja pysyi paikallaan. T칛t칛 kesti noin puoli tuntia ja sen aikana s	Ei	ei	kyll칛	ei	ei	http://fufora.fi/ufodb/ufodata.php?u=204&p=1	60.4518126	22.2666303	pime칛
NA	Helsinki	2010-01-20	"Kaksi 11-vuotiasta koulupoikaa odotti koulup칛iv칛n alkua Vesalan ala-asteen kent칛ll칛 It칛-Helsingiss칛 20.1.2010; kello oli n. 7.40. Pojat katselivat taivaalla t칛hti칛, jolloin he huomasivat yhden ""t칛hden"" liikkuvan. Aluksi kohde n칛ytti muiden t칛htien kaltaiselta, mutta sitten se alkoi tulla l칛hemm칛ksi, kunnes n칛ytti valopallolta, jonka v칛rit vaihtuivat (vain toinen pojista n칛ki v칛rien vaihtelun). Lopulta kohde oli kent칛n yl칛puolella n. 45 asteen kulmassa poikiin n칛hden. Et칛isyys kohteeseen oli 50-60 m. Pojat katsoivat kohdetta n. 3 minuuttia, kunn"	Ei	ei	ei	ei	kyll칛	http://fufora.fi/ufodb/ufodata.php?u=215&p=1	60.16985569999999	24.938379	pime칛
NA	Espoo	1973-01-01	"Oli varhainen kes칛aamu klo oli n.nelj칛, muistaakseni se oli 1973 tai 1974 kes칛kuun alussa, omenapuut kukkivat juuri, eli hieman ennen juhannusta.  
Olin tullut juuri yst칛v칛ni luota kotiin ja koska aamu oli niin ihana, istuin puutarhakeinuun kuuntelemaan lintujen viserryst칛. Silloin havaitsin suoraan l칛nness칛 taivaalla oudonmallisen "" lentokoneen "". Se tuli koko ajan l칛hemm칛s ja kun se oli tarpeeksi l칛hell칛 n칛in sen mallin. Se oli kuin kaksi syv칛칛 lautasta oltaisiin laitettu vastakkain ja pohjassa siin칛 oli mielett칬m칛n kirkkaat, aurinkoa kirkkaa"	Ei	ei	ei	ei	ei	http://fufora.fi/ufodb/ufodata.php?u=227&p=1	60.2054911	24.6559001	auringonlasku_tai_nousu
NA	helsinki	2010-05-12	Olin tupakalla parvekkeella 12.5.10 klo: 00.40 ja huomasin ett칛 ylitseni lensi V aurassa usea iso pallo. N칛ky kesti vain n. 5 sekuntia eik칛 mit칛칛n 칛칛nt칛 kuulunut joten se ei ollut lentokone tai lintuparvi.	Ei	ei	ei	ei	ei	http://fufora.fi/ufodb/ufodata.php?u=277&p=1	60.16985569999999	24.938379	pime칛
NA	Loviisa	2010-07-23	"Vuorokauden vaihtumisen aikoihin olin ajanut n. 100 km matkan 7-tiet칛 id칛n suunnasta. K칛칛nnyin Valkon Hiekkaharjuntielle, tarkoituksena kuunnella kehr칛칛ji칛 tienvarren metsiss칛. Ajoin tiet칛 etel칛칛n hyvin hitaasti, koska kuoppainen ja t칛ynn칛 ""nimismiehen kiharoita"". Pidin kuljettajan puoleista ikkunaa kokonaan auki. Katsoin ikkunasta sattumalta ulos taivaalle, jossa voimakas oranssi valo lounaan suunnassa kiinnitti huomioni. Pys칛ytin auton heti, katsoin k칛nnyk칛n kelloa (00.13), ja menin ulos havainnoimaan n칛ky칛 tarkemmin. Viivyin paikalla yhteens"	Ei	ei	ei	ei	kyll칛	http://fufora.fi/ufodb/ufodata.php?u=302&p=1	60.45787420000001	26.2278099	h칛m칛r칛
NA	Hki	1985-09-01	Tapahtui n.1985 syksyll칛. Olimme yst칛v칛ni kanssa palaamassa Espoon Keski-Mets칛maalta takaisin Helsinkiin bussilla (ns. Vihtil칛isell칛)n. klo 17:00 maissa. Istuimme bussin menosuuntaan vasemmalla takapy칬r칛n kohdalla sij.penkkirivist칬ll칛. Kun saavuimme Haagassa Kaupintien risteykseen  bussi pys칛htyi liikennevalojen vuoksi. Katsoin ikkunasta ulos ja havaitsin n.45 asteen kulmassa taivaalla,bussin kulkusuunnasta 90-60 asteen kulmassa metallisen pallon. Se ei ollut ihan l칛hell칛 ja oli kooltaan n. 2x jalkapallon kokoinen. Bussi l칛hti liikkeelle ja pal	Ei	kyll칛	kyll칛	NA	kyll칛	http://fufora.fi/ufodb/ufodata.php?u=315&p=1	60.16985569999999	24.938379	kirkas p칛iv칛nvalo
NA	Rauma	1993-05-15	"Hei. 
Kirjauduin vasta t칛lle kyseiselle foorumille ja en siis tied칛 t칛st칛 paljoakaan. Mutta olen ehk칛 itse n칛hnyt oman arvioni mukaan tunnistamattoman kohteen Rauman ilmatilassa 1993. 
P칛iv칛 oli selke칛 ja kirkas, normaali kes칛p칛iv칛. Taivas oli pilvet칬n ja seurailin siin칛 Kuuskajaskarista merelle n칛kym칛칛. Kuulin t칛ysin normaalia lentokoneen 칛칛nt칛 ja katsoin. Yli lensi Finnairin MD-11 ja se j칛tti j칛lkeens칛 normaalin vaalean tiivistysvanan. Oli normaali reittikone. 
Aloin tarkkailla meren suuntaan kesken j칛칛nytt칛 havainnointikierrostani. Tarkkaili"	Ei	ei	ei	NA	ei	http://fufora.fi/ufodb/ufodata.php?u=351&p=1	61.1308854	21.5059264	kirkas p칛iv칛nvalo
NA	Turku	2011-05-21	En tied칛 onko t칛m칛 nyt raportin aihe koska en ufoihin usko, mutta olin t칛n칛 aamuna (21.5.2011) koirien kanssa pihalla ennen auringon nousua. K칛velimme l칛heisess칛 mets칛ss칛 tuttua polkua ja olin aika unessa viel칛 kun huomasin kauempana aukiolla valoa tai valopisteit칛. Samalla kun k칛velimme l칛hemm칛s niin valot tuntuvat kuitenkin pienenev칛n ja nousevan taivasta kohti. Kun p칛칛stiin aukiolle niin valot olivat jo todella korkeella, niit칛 oli kymmenen tai ehk칛 hiukan v칛hemm칛n ja ne muodostivat kolmion. Se vain oli taivaalla, yht칛 korkeella kuin lentoko	Ei	kyll칛	ei	ei	kyll칛	http://fufora.fi/ufodb/ufodata.php?u=456&p=1	60.4518126	22.2666303	h칛m칛r칛
NA	Espoo	2011-05-22	olin 22.5 aamuy칬st칛 is칛ni asunnolla Koukkuniemess칛 Espoossa, sohvalla katselemassa kuutamoa. Kun oikeassa kulmassa l칛heisen puun takaa syttyi liikkuva vihre칛/punainen valo, luulin sit칛 ensin t칛hden lennoksi kunnes se teki syv칛n pitk칛n kaaren vasempaan laitaan, meren ja kaukaisen mets칛n taakse. Sen liikkuminen oli liian sulavaa ja v칛ri liian v칛rik칛s t칛hden lennoksi. Juoksin s칛nkyyn karkuun.	Ei	kyll칛	ei	ei	kyll칛	http://fufora.fi/ufodb/ufodata.php?u=459&p=1	60.2054911	24.6559001	pime칛
NA	Ulvila	2011-04-30	Katselin ikkunasta ulos komeita pilvimuodostelmia jotka liikkuivat kohtuullisella nopeudella eteenp칛in (sivusuunnassa havainnoitsijaan n칛hden). Huomioni kohdistui pilven yl칛reunasta, termiikin sis칛lt칛) tulevaan kiilt칛v칛칛n esineeseen, joka selv칛sti oli metallinen. Luulin kohteen olevan ilmapallorykelm칛n, koska oli vappu, mutta kohde oli liian ter칛v칛reunainen ollakseen pallorykelm칛. Lis칛ksi sen liike oli liian tasainen (pilvest칛 tulo ja takaisin meno) eik칛 mit칛칛n ep칛m칛칛r칛ist칛 tuulessa heilumista tapahtunut. En olisi ilmoittanut t칛st칛 mihink칛칛n, m	Ei	ei	ei	ei	ei	http://fufora.fi/ufodb/ufodata.php?u=472&p=1	61.43019349999999	21.8750009	auringonlasku_tai_nousu
NA	Harjavalta	2011-06-01	Olin n. kuukausi sitten 칛itini luona pihalla siskoni kanssa kahvilla puutarhap칬yd칛n ymp칛rill칛,sain kahvin juotoa ja kiinnitin huomion h칛vitt칛j칛koneeseen,joka piirsi viivaa taivaalle. Seurasin sit칛 muutaman sekunnin,kun huomasin koneen l칛hell칛 jonkun py칬re칛n valkoisen ympyr칛n,joka liikkui levottomasti koneen l칛hell칛 muutamia sekunteja,kunnes sitten katosi nopeasti eri suuntaan kuin kone.Katsoin sit칛 koko sen ajan kun se oli esill칛, kun ajattelin ett칛 mik칛 tuo on,ei kai se t칬rm칛칛 tuohon koneeseen kun noin l칛hell칛 liikkuu,siskoni ei sit칛 huomannut	Ei	ei	ei	ei	ei	http://fufora.fi/ufodb/ufodata.php?u=473&p=1	61.3137102	22.1413063	kirkas p칛iv칛nvalo
NA	Kerim칛ki	2011-07-07	Lomittajamme Janne n칛ki oudon py칬rreilmi칬n keskip칛iv칛ll칛. Paalien muovitus oli alkamassa kun 50 metrin p칛칛h칛n ilmestyi py칬rre jossa py칬ri turvetta ja olkia. Py칬rre oli isojen kuusien latvojen korkeudella muodoltaan pallomainen ja oli n칛kyviss칛 parin sekunnin ajan jonka j칛lkeen se katosi puiden taakse. S칛칛 oli tyyni. Noin minuutin p칛칛st칛 kuului kaksi selitt칛m칛t칬nt칛 칛칛nt칛 joiden v칛li n. 3 sekuntia. 컊밡et olivat todella voimakkaita eik칛 verrattavissa mihink칛칛n 칛칛neen. 츿칛net pystyi paikallistamaan heti mist칛 ne kuului mutta siell칛 ei ollut mit칛칛n.	Ei	ei	kyll칛	ei	ei	http://fufora.fi/ufodb/ufodata.php?u=479&p=1	61.9126198	29.2814261	kirkas p칛iv칛nvalo
NA	Kajaani	2008-06-01	"Ajoin t칬ist칛 Vantaalta kotiini Kainuuseen, ansaittuun viikonlopun viettoon, kuten joka perjantai vuosien ajan. Olosuhteet ajamiseen ihanteelliset, oli l칛mmin kes칛y칬, tyyni, pilvet칬n sek칛 aika valoisaa, koska aurinko nousi parastaikaa id칛st칛. Ihailinkin n칛ky칛, laskeutuen loivasti oikealle kaartuvaa alam칛ke칛, alkavalle pitk칛lle suoralle. T칛ll칬in huomioni kiinnittyi taivaalle, puunlatvojen yl칛puolella olevaan kahteen ""hopeiseen"" py칬re칛칛n esineeseen.Esineet olivat t칛ysin sileit칛, saumattomia, ilman mit칛칛n yksityiskohtaa joka olisi j칛칛nyt mieleen. M"	Ei	kyll칛	kyll칛	ei	kyll칛	http://fufora.fi/ufodb/ufodata.php?u=485&p=1	64.2221775	27.7278497	auringonlasku_tai_nousu
NA	forssa	2011-08-08	"forssa 8.8.2011 maanantai ilta/y칬 
tapahtumat alkoivat noin klo:24-01, kellosta ei tarkkaa muistia. 
itse oli jo nukkumassa, puolen y칬n j칛lkeen, ja nuoriso palasi kotiin, baarista, j칛iv칛t ulos viel칛 tupakalle, ennen nukkumaan menoa. 
ja kello silloin n puoli 1 y칬ll칛. 
ensin tuli 2 pilve칛,alapilvi oli soikea ja pitk칛, ja yl칛pilvi vaan pitk칛, alapilvest칛 v칛lkkyi valoja, samalla pihavalot sammuivat, my칬s l칛hist칬lt칛 katuvalot. 
sen j칛lkeen kuului iso rys칛hdys, kuin jokin olisi mennyt jotain p칛in. 
sitten py칬r칛suojan ikkunoihin ilmestyi 3 valopalloa"	Ei	kyll칛	kyll칛	ei	kyll칛	http://fufora.fi/ufodb/ufodata.php?u=503&p=1	60.81463189999999	23.6339467	pime칛
