NA	Kausala	2011-07-24	"23.07.2011 y칬n칛 ehk칛 klo:02 pohjoisesta etel칛칛n kaksi isoa valoa arvio: n.2m halk. erill칛칛n n.4m ehk칛 bussin kokoinen siirtyi n.15s ajassa etel칛칛n,arvio 1km,valot olivat kuin taloissa(ei keilaa)pys칛htyi useiksi minuuteiksi paikalleen,mit칛칛n 칛칛nt칛 ei kuulunut,hain vaimoni katsomaan outoa ilmi칬t칛,otin k칛nnyk칛ll칛 kuvan mutta mustaa vaan siin칛 n칛kyi. 
t칛m칛 tapahtui Jaala/Iitti-Pyh칛j칛rvell칛-Kymi."	Ei	kyll칛	kyll칛	ei	kyll칛	http://fufora.fi/ufodb/ufodata.php?u=498&p=1	60.8893815	26.3395176	pime칛
NA	Helsinkin	2012-08-02	Istuttiin puistonpenkill칛, kaverini poltti tupakkaa. Katuvalot valaisi meit칛, mutta muuten oli h칛m칛r칛칛 ja rauhallista. Meid칛n kaskustelun keskeytti yht칛kki칛 alkanut outo humina. Se voimistui koko ajan ja alettiin kuunnella sit칛. Se oli sellasta joka tuntui kaikuvan, vaikkei ollut mit칛칛 mist칛 se olisi kaikunut. En oikein osaa arvioida aikaa, mutta varmaankin noin puolen minuutin p칛칛st칛 taivaalle alkoi ilmaantua kirkas valo. Ensin me luultiin sit칛 ihan vain lentokoneeksi, mutta sen l칛hestytty칛 me havaittiin ettei lentokone etene sill칛 tavalla eik	Ei	kyll칛	ei	ei	kyll칛	http://fufora.fi/ufodb/ufodata.php?u=692&p=1	60.16985569999999	24.938379	h칛m칛r칛
NA	H칛meenlinna	2010-10-03	"Useat bussimatkustajat ja kuljettaja todistivat outoa valoilmi칬t칛 Forssan ja H칛meenlinnan v칛lisell칛 matkalla taivaalla suoraan edess칛 valtatien yl칛puolella. Matka-Vekan j칛rjest칛m칛 bussikuljetus kyyditsi matkustajia takaisin kotikaupunkeihinsa sunnuntai-iltana Ruotsinlaivalta Turun satamasta. 
Kello yhdeks칛n ja kymmenen v칛lisen칛 aikana valoilmi칬 ilmaantui n칛k칬piiriin liikkuvan bussin edess칛 kaukana taivalla. Ilmi칬 n칛ytti omituiselta 
Koetimme mietti칛 j칛rkev칛칛 selityst칛 n칛ylle mutta emme sellaista keksineet. Onko mahdollista heijasta maasta sella"	Ei	ei	kyll칛	ei	kyll칛	http://fufora.fi/ufodb/ufodata.php?u=327&p=1	60.9928787	24.4590243	pime칛
http://www.suomenufotutkijat.fi/ufodb/_ufoimages/543__1.jpg	Pertteli	1993-08-30	"Kiinnitin huomiota ty칬toverin 칛llistyneeseen ilmeeseen ja suihkuh칛vitt칛j칛n 칛칛neen. Kaverini n칛ki ufon huomattavasti paremmin kuin min칛 n. 20 sekunnin ajan. K칛칛nnyin katsomaan ja n칛in hiljakseen lent칛v칛n ison lautasen n. 400-500 m p칛칛ss칛 ja siit칛 n. 1 km p칛칛ss칛 kovaa tulevan armeijan h칛vitt칛j칛n. 
H칛vitt칛j칛 saavutti lautasta nopeasti t칛ll칬in havaitsin lautasen reunoista nousi ik칛칛nkuin savukiekuroita ja se h칛visi. En tajua miten ? 
Samalla h칛vitt칛j칛 kaartoi pois. Tapaus on j칛칛nyt mieleeni ja mik칛칛n ei muuta mielt칛ni lent칛vist칛 lautasista. 
Uskon "	Kyll칛	ei	ei	ei	ei	http://fufora.fi/ufodb/ufodata.php?u=543&p=1	60.449913	23.237856	kirkas p칛iv칛nvalo
http://www.suomenufotutkijat.fi/ufodb/_ufoimages/344__1.JPG	Kerim칛ki	2009-02-01	"N칛imme vaimoni kanssa sellaisen valoilmi칬n jolle emme keksi mink칛칛nlaista j칛rjellist칛 selityst칛!! 
Tapahtui 01.02.2009 Kello 19:10 Kerim칛ell칛 omakotitalomme pihan l칛hell칛. 
Olimme tulossa autolla Kerim칛en kirkonkyl칛n suunnasta kotiimme Joensuun suuntaan. 
Huomasin edess칛mme hieman puiden latvojen yl칛puolella oudosta suunnasta tulevaa valoa. 
Sanoin vaimolle ett칛 katso mist칛 nuo valot tulevat. 
Olimme kilometrin p칛칛ss칛 kotoa sill칛 hetkell칛. 
Vaimo s칛ik칛hti ja sanoi ett칛 ne tulee meid칛n talolta. 
Talomme sijaitsee kantatie 71:n varrella asumattom"	Kyll칛	ei	ei	ei	ei	http://fufora.fi/ufodb/ufodata.php?u=344&p=1	61.9126198	29.2814261	kirkas p칛iv칛nvalo
NA	H칛meenlinna	2012-01-03	Televisiota katsellessa vasemalla ikkunasta n칛kyi nopeasti liikkuva kirkas valo. Sanoin vaimolle katso mik칛 toi on. Ilotulitus tuoreessa muistissa ei muistuttanut mit칛칛n ilotulitusrakettia . Siin칛 oli jotain mahtavaa yliluonnollisen tuntua.	Ei	ei	ei	ei	kyll칛	http://fufora.fi/ufodb/ufodata.php?u=588&p=1	60.9928787	24.4590243	pime칛
NA	Siuntio	2013-12-03	Olin palaamassa kotiin t칬ist칛 Siuntion kautta Lohjan suuntaan Lappersintiet칛 pitkin. Ihailin auringonlaskua, kun huomasin, ett칛 auringonlaskussa ja sen edess칛 olevien pilvien v칛liss칛 meni jokin todella kovaa vauhtia vaakatasossa. N칛in sen ensimm칛isen kerran horisonttiin juuri laskevan auringon yl칛puolella, kun auringonvalo heijasti t칛st칛 kohteesta. Olin t칛ll칬in Svartb칛ckin kohdalla ja kun sain k칛nnykk칛ni (Lumia 1020) esille ja otettua kuvan, olin Lappersintie 373 kohdalla. T칛ss칛 kuvassa kohde oli kuitenkin pilven takana, enk칛 ajaessani enempi칛 	Ei	ei	ei	ei	ei	http://fufora.fi/ufodb/ufodata.php?u=1178&p=1	60.1385818	24.2269874	kirkas p칛iv칛nvalo
http://www.suomenufotutkijat.fi/ufodb/_ufoimages/1179__1.jpg	Siuntio	2013-12-03	Olin palaamassa kotiin t칬ist칛 Siuntion kautta Lohjan suuntaan Lappersintiet칛 pitkin. Ihailin auringonlaskua, kun huomasin, ett칛 auringonlaskussa ja sen edess칛 olevien pilvien v칛liss칛 meni jokin todella kovaa vauhtia vaakatasossa. N칛in sen ensimm칛isen kerran horisonttiin juuri laskevan auringon yl칛puolella, kun auringonvalo heijasti t칛st칛 kohteesta. Olin t칛ll칬in Svartb칛ckin kohdalla ja kun sain k칛nnykk칛ni (Lumia 1020) esille ja otettua kuvan, olin Lappersintie 373 kohdalla. T칛ss칛 kuvassa kohde oli kuitenkin pilven takana, enk칛 ajaessani enempi칛 	Kyll칛	ei	kyll칛	ei	kyll칛	http://fufora.fi/ufodb/ufodata.php?u=1179&p=1	60.1385818	24.2269874	auringonlasku_tai_nousu
NA	Ylikiiminki	1970-10-01	"
 Tapahtui -70 luvulla. Asui silloin kotitilalla Ylikiimingin Joloskyl칛ss칛,miss칛 oli normaali maalaismaisema rakennuksineen. Oli pime칛 lokakuun loppu kello noin 23:00,suljin television pirtiss칛 ja l칛hdin menem칛칛n makuulle kamariin keitti칬n poikki, sivun ikkunat on etel칛n suunnassa vastap칛칛t칛 iso karjarakennus rehuvarastoineen. 
J칛hmetyin kauhusta, koko vastap칛inen rakennus loimusi tulessa, lieskat oli punaisia ja keltaisia, nuollen alhaalta harjan ylikin. 
Tietysti aloin parkumaan, ettei el칛imi칛 saa mitenk칛칛n pelastettua ja miten se on voinut s"	Ei	ei	ei	ei	ei	http://fufora.fi/ufodb/ufodata.php?u=575&p=1	65.02861399999999	26.1466701	pime칛
NA	Hamina	2013-12-01	"Moi 
Satuin tossa tupakalla ollessani omasta mielest칛ni v칛hint칛칛n omituisen t칛hden-lennon silminn칛kij칛ksi. 3 p칛iv칛칛 sitten, k칛vin y칬ll칛 tupakalla muun perheen nukkuessa. katselin kirkkaita t칛hti칛 ja mietin miten pilvet칬n on s칛칛.. olen t칛h칛n menness칛 pit칛nyt pohjant칛hten칛 t칛hte칛, joka on kirkkain taivaalla, ja joka meille t칛nne n칛kyy joka y칬. en ole t칛htitieteilij칛 enk칛 ufologi joten en tunne t칛hte칛. Kauniin kirkkaana kuitenkin palaa. P칛칛asia on se, ett칛 kysyisin, ett칛 miksi sen kirkkaimman t칛hden vieress칛. oli toinen kirkas t칛hti? Ja takuuvarma"	Ei	ei	ei	ei	kyll칛	http://fufora.fi/ufodb/ufodata.php?u=990&p=1	60.5693374	27.1878318	pime칛
http://www.suomenufotutkijat.fi/ufodb/_ufoimages/390__1.jpg	Perho	2010-07-01	"Olemme tavanneet sukulaiseni kanssa tarkkailla luontoa ja t칛htitaivaan n칛kyess칛 satelliittej칛 ja taivaan tapahtumia. 
Tarkkaa p칛iv칛m칛칛r칛칛 en muista mutta muistan ett칛 TVss칛 uutisoitiin kansainv칛lisen avaruusaseman(vai olisiko ollut joku iso satelliitti? No kuitenkin) n칛kyv칛n/peilaavan l칛hiaikoina maahan... 
Tarkkailimme noin pariviikkoa ennen t칛t칛 tapahtumaa taivasta ja havaitsimme lukuisia satelliittej칛 ja t칛hdenlentoja, kunnes havaitsimme omituisen kolmikon taivaalla arviolta satojen kilometsien p칛칛ss칛, tummanharmaita/ruskeita kappaleita kulk"	Kyll칛	ei	ei	ei	ei	http://fufora.fi/ufodb/ufodata.php?u=390&p=1	63.2440259	24.3710448	pime칛
NA	Lohja	2015-02-04	N칛in valoilmi칬n jota en kykene itse selitt칛m칛칛n. N칛in puiden latvojen korkeudella kaksi v칛l칛hdyst칛 Atlaanhaantien vieress칛, n칛kyi kaksi v칛l칛hdyst칛 joka valaisi puiden latvoja ja maastoa, t칛m칛n per칛칛n kuului kaksi kertaa lyhyt 칛칛ni, joka oli samanlainen kummallakin kertaa. En osaa selitt칛칛 sit칛 milt칛 칛칛ni kuulosti. Noin puolen minuutin kuluttua n칛kyi uudestaan v칛l칛hdys, vain yksi, ja per칛칛n kuului samanlainen 칛칛ni kuin aikaisemmin olin kuullut v칛l칛hdysten j칛lkeen, t칛m칛kin vain kerran uudestaan. Tapahtui 4.2.2015 v칛lill칛 19.30-19.45 .	Ei	ei	kyll칛	ei	kyll칛	http://fufora.fi/ufodb/ufodata.php?u=1189&p=1	60.251176	24.0674709	h칛m칛r칛
NA	Kuopio	2013-03-04	"4.3.2013 
Klo 05.45 avopuolisoni oli viem칛ss칛 minua t칬ihin aamulla. Pakkasta  
-17 ja t칛hti칛 n칛kyi.  
Ajoimme minun vakio reitti칛 t칬ihin. Kotoa Haapaniemelt칛 Itkonniemeen ja sielt칛 kohti Likolahtea, joka on yritys /teollisuusaluetta. 
Ty칬matkan loppupuolella havaitsimme ensin vasemmalla puiden latvojen yl칛puolella py칬re칛n erikoisen vihre칛n kirkkaan valopallon, joka liikkui hitaasti puiden ""sekaan"". Valopallo hohti saman v칛rist칛 vihre칛칛 valoa ymp칛rilleen voimakkaasti.  
Avopuolisoni hiljensi heti havainnon alussa vauhtia ja vaikka liikkuva auto "	Ei	ei	ei	ei	kyll칛	http://fufora.fi/ufodb/ufodata.php?u=812&p=1	62.89796999999999	27.6781725	pime칛
NA	helsinki	2013-04-04	"to 4.4.13  n. klo 16.02-16.10 (kellonaika noin v칛lill칛) 
4 tunnistamatonta objektia lensi Malmin Tattarisuon suunnasta Heikinlaakson Kalliotien yli (Helsinki) Tapulikaupungin suuntaan. Objektit n칛yttiv칛t ik칛칛nkuin pienilt칛 t칛hdilta tai ""tulik칛rp칛silt칛"" ja ne lensiv칛t ryhm칛ss칛 ja tekiv칛t joitain kuvioita. Sitten kahden objektin ryhmiss칛 objektit lensiv칛t toisiaan kohti ja katosivat jonnekin. Havainto kesti ehk칛 n 15-20 sekuntia."	Ei	ei	ei	NA	ei	http://fufora.fi/ufodb/ufodata.php?u=846&p=1	60.16985569999999	24.938379	kirkas p칛iv칛nvalo
http://www.suomenufotutkijat.fi/ufodb/_ufoimages/66__1.JPG	Korppoo	2009-02-09	"B.Borg 4.5.2009: Pirte칛 76- rouva Korppoosta soitti SUTn havaintopuhelimeen 17.2.2009 ja kertoi ett칛 h칛n oli monena iltana n칛hnyt ufon py칬riv칛n taivaalla klo 19 j칛lkeen. H칛n oli n칛hnyt sen jo 9.2 illalla mutta taas 16 ja 17.2.2009.  
SUTilla ei kuitenkaan ollut ket칛칛n joka olisi voinut l칛hte칛 Korppooseen tutkimaan tilannetta. 
Rouva soitti uudelleen 18.2.2009 ja kertoi ett칛 ' ne ufot liikkuvat UTh칬n menev칛n laivav칛yl칛n p칛칛ll칛 ' . 
25.2.2009 SUTin tutkimusp칛칛llikk칬 l칛hetti minulle taas viestin ett칛 rouva oli taas soittanut ja kertonut ett칛 ' ne "	Kyll칛	ei	ei	ei	kyll칛	http://fufora.fi/ufodb/ufodata.php?u=66&p=1	60.162672	21.5620048	pime칛
NA	Lappeenranta	2013-12-01	"Olin ilta k칛velyll칛 vaimoni kanssa joulukuun alussa 2013. Kellon aika oli l칛hell칛 kymment칛 illalla.  
Katselin siin칛 tepastellessa taivaalle koska t칛hdet n칛ky hyvin.  Eli taivas oli kirkas eik칛 pilvi칛 ollut, tai niit칛 ei vaan n칛hny.   
Jossain vaiheessa huomasin normaalin liikkuvan t칛hden ja hieman himme칛mpi kuin muut t칛hdet joka liikkui tasaista vauhtia. Seurasin sit칛 aikani kunnes sen vauhti nopeutui hieman ja sit se rupes kirkastumaan. Se kirkastu nopeasti, mutta ei v칛l칛ht칛en..  Se oli valkoisen kirkas ja muihin t칛htiin verratuna varmaan 4-6"	Ei	ei	ei	ei	kyll칛	http://fufora.fi/ufodb/ufodata.php?u=1059&p=1	61.05499289999999	28.1896628	pime칛
NA	Tampere	2014-04-15	Olin tulossa kotiin t칬ist칛, ajoin auton parkkiin ja k칛velin kotia kohti pihan poikki. Huomioni kiinnittyi taivaaalla lent칛v칛칛n pien lentokoneeseen joka lensi asuinpaikkani yll칛 lentosuuntana noin pohjoinen. Samalla huomioni kiinnitti valon heijastus. Heijastus tuli lent칛v칛st칛 py칬re칛st칛 metallinv칛risest칛 pallosta.	Ei	ei	ei	ei	kyll칛	http://fufora.fi/ufodb/ufodata.php?u=1060&p=1	61.4977524	23.7609535	auringonlasku_tai_nousu
NA	Helsinki	2012-07-04	"Helsingin Leikkipuisto Nuolen ymp칛rill칛 p칬rr칛si helikopteri. Kun helikopteria seurailtiin, joku leikkipuiston henkil칬kunnasta huomasi taivaalla kaksi vaaleaa pistett칛 jotka liikkuivat hitaasti. Ihmisi칛 ker칛칛ntyi yhteen ja monet havaitsivat taivalla liikkuvat t칛pl칛t. Silm칛 juuri ja juuri havaitsi. Valkoisia pilkkuja oli helppo seurata, ne eiv칛t menneet kovaa, mutta olivat korkealla ja ilmeisen kaukana. ""T칛pl칛t"" pitiv칛t et칛isyyden mutta v칛lill칛 vaikutti kun toinen olisi k칛칛ntynyt eteen, eli olisivat menneet ""akselinsa ymp칛ri"". N칛ytti my칬s silt칛, "	Ei	ei	ei	ei	ei	http://fufora.fi/ufodb/ufodata.php?u=675&p=1	60.16985569999999	24.938379	kirkas p칛iv칛nvalo
http://www.suomenufotutkijat.fi/ufodb/_ufoimages/516__1.jpg	h칛meenlinna	2011-09-03	"Olin parvekkeella katselemassa t칛hti칛 kunnes kohde ilmestyi n칛kyviin koilisesta kovaa vauhtia. n칛ytti ensin t칛htisumulta valojen takia ja n칛ytti tulevan suoraan ""t칛hdist칛"" n칛kyviin laskeutuen alemmas. kohde l칛hestyi kunnes se h칛visi n칛k칬piirist칛 kohti kaakkoa, puiden taakse.  
Kohde lensi lopussa pilvien t칛ll칛 puolen, nopeus oli arviolta 2-3x matkustajakoneen vauhti, 칛칛nt칛 ei syntynyt eik칛 j칛칛nyt tiivistysvanaa per칛칛n. 
Kohteen koko oli, k칛si suoraksi ojennettuna, sormien v칛liin mitattuna 3cm. joten lensi todella matalalla. 
Muoto muistutti lin"	Kyll칛	ei	ei	ei	ei	http://fufora.fi/ufodb/ufodata.php?u=516&p=1	60.9928787	24.4590243	pime칛
NA	Juankoski	2016-09-26	"Hei. 
Muistelen ett칛 samasta ilmi칬st칛 olen aiemminkin (2 vuotta sitten) ilmoittanut.Silloin oli t칛htikirkas taivas.Vastausta ei ole kuulunut.Toivottavasti nyr. 
Alkuviikolla samalainen toistui,nyt ilma oli vain t칛ysipilvinen 
Vaimolla ei aluksi silm칛laseja minulla kyll칛"	Ei	ei	ei	ei	kyll칛	http://fufora.fi/ufodb/ufodata.php?u=1452&p=1	63.0660831	28.3308111	h칛m칛r칛
NA	Pori	2016-10-04	"Saavuin kotiin t칬ist칛 aamuy칬lla 14.10, ja ajattelin viel칛 poltella tupakan ennen unille menoa.Ja koska oli t칛htikirkas tyyni y칬, ihailin t칛htitaivasta. L칛nnest칛 l칛hestyi valo, joka kulki pohjoiseen mukavaa vauhtia, mietiskelin mik칛h칛n sateliitti mahtaa olla, kohde h칛ipyi rakennusten katveeseen, ja samalla huomioni kiinnittyi kirkaaseen ""pohjant칛hteen"". Tumppasin tupakan ja olin menossa sis칛lle, kun tajusin jottei se voi olla pohjant칛hti. Istuin alas ja katselin luoteiselle taivaalle. Kirkas ""t칛hti"" oli 50/60 asteen kulmassa minusta (NW 325/335 "	Ei	ei	kyll칛	ei	kyll칛	http://fufora.fi/ufodb/ufodata.php?u=1453&p=1	61.4851393	21.7974178	pime칛
NA	Soini	2011-01-05	"Pakko laittaa viesti칛 kun en tied칛 minne kirjoittaisin! Olimme juuri menossa mieheni kanssa nukkumaan 칛sken eli noin puoli yksi y칬ll칛 ( 5.1.2012 ) ja olimme jo sammuttaneet valot kun yht칛kki칛 makuuhuoneen ikkunan ulkopuolella alkoi v칛l칛htelem칛칛n jokin sininen kirkas valo. v칛l칛htely n칛kyi s칛leverhojen l칛pi niiden ollessa suljettuina. mieheni avasi s칛leverhot ja katsoi ulos niin aivan kattomme yl칛puolella taivaalta v칛lkehti sininen kirkas valo jonka itsekin n칛in. Pel칛styimme todella, mutta uutisissa ei n칛y viel칛 ainakaan olevan mit칛칛n.. 
v칛l칛hdyk"	Ei	kyll칛	kyll칛	kyll칛	kyll칛	http://fufora.fi/ufodb/ufodata.php?u=589&p=1	62.8731978	24.2063742	pime칛
http://www.suomenufotutkijat.fi/ufodb/_ufoimages/223__1.JPG	Nurmij칛rvi	2010-02-02	Yks ilta ku valvoin salaa mini kannettavan kanssa huomasin jotain todella j칛rkytt칛v칛칛 ainakin omasta mielest칛ni avain uskomatonta !!! katoin elokuvaa nimelt칛 daddy day camp minikannettaval netis ja olin peiton alla.oti peiton v칛h칛ksi aikaa pois p칛칛lt칛 koska kannettava puhalsi kuumentuessa l칛mmint칛 ilmaa peiton sis칛lle. sitten huomasin ikkunan luona v칛lkkymist칛 mets칛n yl칛 puolella.katsoin aluksi ett칛 se on lentokone.tarkkailin sit칛 koska tapahtui jotain outuu mit칛 lento kone ei pystyis teh칛. Se pys칛htyi paikalleen.kun katsoin tarkemmin sit칛 n칛in	Kyll칛	kyll칛	kyll칛	NA	ei	http://fufora.fi/ufodb/ufodata.php?u=223&p=1	60.4654987	24.8071756	kirkas p칛iv칛nvalo
http://www.suomenufotutkijat.fi/ufodb/_ufoimages/391__1.jpg	Tornio	2011-01-11	"11.1.2011 n. klo15.00 olin lapsieni kanssa ulkoilemassa omalla pihalla Tornion Kantoj칛rvell칛 kun 2-vuotias poikani alkoi osoittelemaan taivaalle. Katsoin yl칬s ja n칛in t칛m칛n ""valopallon"" liikkuvan hitaasti hieman viistosti alasp칛in. Mit칛칛n 칛칛nt칛 ei kuulunut. Juoksin hakemaan kameran ja sainkin napattua nelj칛 kuvaa. Lopulta valopallo katosi puiden latvojen taakse."	Kyll칛	kyll칛	kyll칛	ei	kyll칛	http://fufora.fi/ufodb/ufodata.php?u=391&p=1	65.847301	24.1520236	h칛m칛r칛
http://www.suomenufotutkijat.fi/ufodb/_ufoimages/802__1.jpg	Muhos	2008-01-28	Olin aamulla tallit칬iss칛. Talutin hevosta tarhaan. Hevonen pys칛hteli ja k칛ytt칛ytyi pelokkaasti, joten aloin katsella ymp칛rilleni, mit칛 hevonen pelk칛si. Silloin havaitsin n. 100m. p칛칛ss칛 pajujen yl칛puolella leijailevan renkaan muotoisen ufon. Ufo oli keltainen ja siin칛 oli keskell칛 tumma py칬re칛 kohta. Havaintoaika oli n. 15min.	Kyll칛	kyll칛	kyll칛	ei	ei	http://fufora.fi/ufodb/ufodata.php?u=802&p=1	64.8075384	25.9942517	kirkas p칛iv칛nvalo
NA	Oulu	2011-03-03	Asun Oulun keskustassa. Oulussa oli komeat revontulet nyt keskiviikkona 2.3.2011. Olin menossa nukkumaan puolen y칬n j칛lkeen, kun halusin viel칛 hetken ihaillla harvinaista revontulin칛ytelm칛칛 olohuoneeni ikkunasta. Sammutin muut valot, jotta n칛in kunnolla. Ikkuna avautuu luoteeseen. Revontulet olivat luoteen ja pohjoisen v칛lill칛. Ensin luulin n칛kev칛ni t칛hdenlennon suoraan luoteeseen, melko korkealla taivaalla, kohtisuoraan ylh칛칛lt칛 alasp칛in. Koska valo ei kadonnut, ajattelin kyseess칛 olevankin satelliitti. Se oli kooltaan ja kirkkaudeltaan kirkka	Ei	ei	kyll칛	ei	kyll칛	http://fufora.fi/ufodb/ufodata.php?u=405&p=1	65.0120888	25.4650773	pime칛
http://www.suomenufotutkijat.fi/ufodb/_ufoimages/615__1.jpg	Pieks칛m칛ki	2010-05-14	"Istuin tietokoneeni edess칛 ikkunan vieress칛,vilkaisin ikkunasta ulos niin n칛in soikean aluksen ja samassa aluksesta l칛hti sininen,kait lasers칛de minua kohti osuen vasempaan k칛teeni.En pel칛stynyt eik칛 s칛de satuttanut j칛i vain mustelma.L칛hdin kohta siskoni luokse keskustaan ja kerroin h칛nelle mit칛 olin kokenut,n칛hnyt. 
e"	Kyll칛	ei	kyll칛	ei	ei	http://fufora.fi/ufodb/ufodata.php?u=615&p=1	62.29499509999999	27.13305	kirkas p칛iv칛nvalo
NA	Pattijoki	2013-03-31	"Ajoin autolla tytt칛reni 1v kansa p칛칛si칛isen vietosta kotia. Ajoin korkelontiet칛 noin 30km/H samalla taivaalle t칛hyillen ett칛 n칛kyyk칬 t칛hti칛. Huomasin kaksi ""t칛hte칛"" vierekk칛in, jotka olivat v칛h칛n normaalia kirkkaampia. Sitten kun ajelin huomasin ett칛 oikean puoleinen t칛hti l칛hti vaakatasossa pohjoiseen. Ajattelin ett칛 mit칛 vittua??? sitten se toinen ""t칛hti"" joka j칛i, l칛hti samanlaista vauhtia toiseen suuntaan. Sitten ajattelin ett칛 ihmett칛!!! seurasin n칛iden t칛htien menoa jotain 8s ja sitten p칛칛tin ajaa 칛kki칛 400 metri칛 kotia ja pyyt칛칛 puolison"	Ei	ei	ei	ei	kyll칛	http://fufora.fi/ufodb/ufodata.php?u=844&p=1	64.69260419999999	24.5746093	pime칛
NA	Vaasa	2012-05-04	Tulimme yst칛v칛ni kanssa autolla h칛nen kotikadulleen. Molemmat n칛imme samaan aikaan 20-30 metri칛 korkealla valoja. Kaksi hehkulampunv칛rist칛 paikalla olevaa ja yksi oranssi vilkkuva valo ja yksi keltainen edes-takaisin liikkuva, alasp칛in levenev칛 valo. Pys칛hdyimme autolla, avasimme ikkunan ja suljimme radion. Mit칛칛n 칛칛nt칛 emme kuulleet. N칛iden tapahtumien aikana alus liikkui 10-20 metri칛 eteenp칛in. Otimme kamerak칛nnyk칛n esiin ja yritimme ottaa kuvaa, mutta valoja ei kamerassa n칛kynyt. T칛m칛n j칛lkeen alus suuntasi kerrostalon taakse, jolloin p칛칛tim	Ei	kyll칛	ei	ei	kyll칛	http://fufora.fi/ufodb/ufodata.php?u=653&p=1	63.09508899999999	21.6164564	h칛m칛r칛
http://www.suomenufotutkijat.fi/ufodb/_ufoimages/897__1.jpeg	Teuva	2013-06-21	Tulimme juhannusaattona avoautolla, katto auki, Teuvalta kohti Horoa. Istuin apukuskin paikalla ja vilkaisin matkalla oikealla puolen tiet칛 olevalle mets칛aukealla olevalle pellolle. N칛in aivan tarkasti ilmassa leijuvan esineen, joka heijasti melko matalla olevan auringon s칛teit칛 niin ett칛 sain vaikutelman tummasta metallipinnasta. Sen v칛h칛isen ajan mit칛 min칛 esineen n칛in painoin tarkasti muistiin yksityiskohtia, kuten muodon, v칛rin ja materiaalin. Vasta kun puusto peitti esineen hihkaisin miehelleni, joka ajoi autoa, ett칛 n칛in jotain kummaa, t칛	Kyll칛	ei	kyll칛	ei	ei	http://fufora.fi/ufodb/ufodata.php?u=897&p=1	62.48003749999999	21.7392081	auringonlasku_tai_nousu
http://www.suomenufotutkijat.fi/ufodb/_ufoimages/500__1.jpg	Helsinki	2011-08-05	Poikani n칛ki kohteen taivaalla eilen puolenp칛iv칛n j칛lkeen. Soitti asiasta minulle. Kehoitin ottamaan kuvan.	Kyll칛	ei	ei	ei	ei	http://fufora.fi/ufodb/ufodata.php?u=500&p=1	60.16985569999999	24.938379	kirkas p칛iv칛nvalo
NA	salokyl칛	1978-01-17	oli ilta y칬 ja n칛in ikkunasta sikarin muotoisen hohtavan esineen jari turpeinen n칛ki sen my칬s oli menossa j칛칛kiekkoilemaan jarin kohdalla se hieman laskeutui jari kaatui hankeen	Ei	kyll칛	ei	ei	kyll칛	http://fufora.fi/ufodb/ufodata.php?u=493&p=1	62.5811562	29.4873626	pime칛
NA	Oulu	2013-09-04	Menin parvekkeelle tupakalle 4.9.2013, klo oli 22.31. Kerkesin katsella taivaalle noin minuutin ajan ja yht칛kki칛 huomasin koillisesta lounaaseen suuntautuvan valopisteen. Nopeus oli suhtkoht nopea, ei miss칛칛n nimess칛 lentokone tai satelliitti, valopisteen koko kuitenkin satelliitin luokkaa. Erikoista valopisteen etenemisess칛 oli se, ett칛 nopea liike pys칛htyi ja jatkoi matkaa l칛hes saman tien, t칛m칛 pys칛htyminen tapahtui kaksi kertaa, ennenkuin kohde h칛visi naapuritalon taakse. Havainnon kesto noin 2-3 sekuntia.	Ei	ei	kyll칛	ei	ei	http://fufora.fi/ufodb/ufodata.php?u=937&p=1	65.0120888	25.4650773	pime칛
NA	Oulu	2013-09-04	Menin parvekkeelle tupakalle 4.9.2013, klo oli 22.31. Kerkesin katsella taivaalle noin minuutin ajan ja yht칛kki칛 huomasin koillisesta lounaaseen suuntautuvan valopisteen. Nopeus oli suhtkoht nopea, ei miss칛칛n nimess칛 lentokone tai satelliitti, vaan huomattavasti nopeampi, valopisteen koko kuitenkin satelliitin luokkaa. Erikoista valopisteen etenemisess칛 oli se, ett칛 nopea liike pys칛htyi ja jatkoi matkaa l칛hes saman tien, t칛m칛 pys칛htyminen tapahtui kaksi kertaa, ennenkuin kohde h칛visi naapuritalon taakse. Havainnon kesto noin 2-3 sekuntia. Ajatt	Ei	ei	kyll칛	ei	ei	http://fufora.fi/ufodb/ufodata.php?u=938&p=1	65.0120888	25.4650773	pime칛
NA	Kerava	2011-10-05	5,10,2011 Illalla 20:30 -21.00 kun k칛vin tupakilla parvekkeella huomasin 2 kohdetta ilmestyv칛n taivaalle aluksi luulin kohteita lentokoneiksi jota t칛ss칛 kulkee todella paljon mutta kun toinen kohde oli punainen ja suorakulmoin muotoinen josta ilmestyi pienempi py칬re칛 esine jonka v칛ri vaihteli valkoseksi,siniseksi ja punaiseksi.. aloin kiinostua enemm칛n asiasta pienempi kohde liikkui huikeita kuvioita yl칬s alas sivulle ja viistoon aivan uskomatonta vauhtia sain pienemm칛st칛 kohteesta kuvattua noin 3 min videota ennen kuin se katosi. isompi kohde 	Ei	ei	kyll칛	ei	ei	http://fufora.fi/ufodb/ufodata.php?u=545&p=1	60.4009878	25.1020384	pime칛
http://www.suomenufotutkijat.fi/ufodb/_ufoimages/156__1.jpg	Espoo	2009-11-06	Hei ! L칛hdin kauppaan noin klo 17.00. Huomasin, ett칛 sama outo valokaari n칛kyi taas taivaanrannassa, mets칛n reunassa. L칛hdin k칛velem칛칛n kauppaan. Matkaa on noin 1 km tai v칛h칛n yli. Havaitsin, ett칛 valokaari alkoi kulkea mets칛nreunaa my칬t칛ellen. Kaari kulki samaa vauhtia kuin min칛 k칛velin. Yht칛kki칛 kaariakin oli 2 kappaletta.Jonkun ajan kuluttua n칛in kun n칛m칛 valokaaret tekiv칛t muodostelman siten, ett칛 toinen oli yl칛puolella ja toinen alapuolella.T칛ss칛 kohtaa ilmestyi n칛iden valokaarien v칛liin tummanpunainen osa , paksumpi kuin n칛m칛 valokaaret.S	Kyll칛	ei	kyll칛	ei	ei	http://fufora.fi/ufodb/ufodata.php?u=156&p=1	60.2054911	24.6559001	h칛m칛r칛
NA	Vantaa	1995-10-31	"Seisoskelin Korsossa juuri havaintohetkell칛 yksin kotitalomme pihamaalla muun perheen siirt칛ess칛 kaniamme leikkim칬kist칛 talviasuntoonsa kellariin. 
Ajankohta oli siis jo melko my칬h칛ist칛 syksy칛, 31.10.1995, n. klo 20.30-21.00. 
Siin칛 seisoskellessani havaitsin silm칛kulmassani pohjoisen suunnassa jonkinlaista liikett칛. Ajattelin, ett칛 kurkiaura se sielt칛 tulee pohjoisen suunnasta kohti etel칛칛, kun antoi hieman levottoman alkuvaikutelman silm칛kulmaani.  
Aluksi vaikutti silt칛, kuin tuo melkein yl칛puolellani havaitsemani ""tiivistym칛"" olisi muodostu"	Ei	ei	ei	ei	kyll칛	http://fufora.fi/ufodb/ufodata.php?u=154&p=1	60.29335239999999	25.0377686	pime칛
NA	Vantaa	1999-10-08	"Katselin pihallamme Korsossa taivasta sen seljetty칛 sen verran, ett칛 t칛hdet n칛kyiv칛t melko suurelta osin taivasta. 
Heitin jonkinlaisen kiitoksen ilmoille siit칛, ett칛 taivas oli seestynyt muutaman pilvisen p칛iv칛n j칛lkeen! 
N칛kyi paljon, mielest칛ni jopa tavallista enemm칛n, satelliitteja lent칛v칛n radoillaan.  Olen n칛hnyt satelliittien v칛l칛htelev칛n auringonvalon osuessa niihin.  V칛l칛hdykset tapahtuvat melko nopeasti ja himmenev칛t satelliitin kulkiessa maan varjoon.  T칛llaisen tapauksen n칛inkin ja kiinnitin siihen huomioni. 
Sitten tuli seuraava ""s"	Ei	ei	ei	ei	kyll칛	http://fufora.fi/ufodb/ufodata.php?u=155&p=1	60.29335239999999	25.0377686	pime칛
