NA	Alaj칛rvi	2011-12-26	Olin joulunvietossa maatilalla. Kello oli noin 03.00 ja olin huoneessani joka sijaitsee talon alakerrassa, huoneessa on suuret ikkunat maan tasolla etel칛칛n ja l칛nteen p칛in. Olin juuri sammuttanut valot ja valmiina menem칛칛n nukkumaan. Silloin huoneeseeni heijastui etel칛ikkunasta valo joka n칛ytti aluksi samalta, kuin se jonka noin sadan metrin p칛칛ss칛 olevaa maantiet칛 kulkevien autojen valot aiheuttavat, mutta huomioni kiinnittyi v칛litt칬m칛sti, sill칛 en kuullut mit칛칛n 칛칛nt칛. oli t칛ysin tyyni pime칛 talviy칬 ja normaalisti tiell칛 kulkeva henkil칬autoki	Ei	ei	kyll칛	ei	kyll칛	http://fufora.fi/ufodb/ufodata.php?u=924&p=1	63.0001054	23.8159263	pime칛
http://www.suomenufotutkijat.fi/ufodb/_ufoimages/138__1.jpg	Somerniemi/Somero	2004-02-15	"Helmikuu 2004 n.klo 14.00 puoliv칛li kuuta sunnuntaina. P칛iv칛 oli aurinkoinen ja pakkasta oli n. 2 astetta. 
Aurinko n칛kyi mets칛n l칛pi ja oli kuin auringon edess칛 olisi ollut rypistetty elintarvikemuovia. 
Halusin ottaa juuri sen takia valokuvan siit칛. Valokuva kun kehitettiin niin siin칛 oli vasemmassa yl칛kulmassa jokin esine. Koivu sijaitsee n. 30 m p칛칛ss칛 minusta ja mets칛 n.50 m. 
Kamerassa ei ole mit칛칛n s칛칛t칬juttua. Halusin testaa t칛t칛 kameraa otin kaikenlaisia kuvia ymp칛rist칬st칛 miss칛 olin k칛velyll칛. Olin yli 2 km p칛칛ss칛 mets칛ss칛 miss칛 oli t"	Kyll칛	ei	ei	ei	ei	http://fufora.fi/ufodb/ufodata.php?u=138&p=1	60.5703772	23.748512	kirkas p칛iv칛nvalo
http://www.suomenufotutkijat.fi/ufodb/_ufoimages/212__1.jpg	Sundom	2010-01-12	Katso tapaus nro.211	Kyll칛	ei	ei	NA	ei	http://fufora.fi/ufodb/ufodata.php?u=212&p=1	63.0366219	21.5504796	kirkas p칛iv칛nvalo
NA	Pori	2010-08-01	"Katselin yhdess칛 mieheni kanssa parvekkeelta (7. kerros) y칬taivasta puolen y칬n j칛lkeen, sill칛 uutisissa oli kerrottu sin칛 y칬n칛 olevan poikkeuksellisen paljon t칛hdenlentoja. N칛immekin useita t칛hdenlentoja, kunnes huomioni kiinnittyi ""vastavirtaan"" lent칛v칛칛n ""t칛hteen"". T칛hden kokoinen ja n칛k칬inen valopallo risteili taivaalla tehden 칛kkik칛칛nn칬ksi칛 ja liikkuen v칛lill칛 hitaasti, l칛hes paikallaan ja ampaisten sitten silm칛nr칛p칛yksess칛 koko taivaankannen poikki vaihtaen v칛lill칛 칛kkin칛isesti suuntaa. Seurasimme kohdetta n. 2-3 minuuttia, kunnes se katos"	Ei	kyll칛	ei	ei	kyll칛	http://fufora.fi/ufodb/ufodata.php?u=793&p=1	61.4851393	21.7974178	pime칛
NA	Espoo	2012-12-14	K칛velin koiran kanssa aamulenkki칛, kun silm칛kulmasta havaitsin oudon v칛l칛hdyksenomaisen valon taivaalla. Katsoin yl칬s ja toinen samanlainen vaalean vihert칛v칛 valojuova v칛l칛hti ja katosi n칛kyvist칛.	Ei	ei	ei	NA	kyll칛	http://fufora.fi/ufodb/ufodata.php?u=782&p=1	60.2054911	24.6559001	pime칛
NA	Lahti	2013-03-30	Olin l칛hd칬ss칛 koiraa iltapissattamaan yhdentoista ja kahdentoista v칛lill칛 tytt칬yst칛v칛ni kanssa. Samalla reissulla heitin pari s칛kki칛 roskia j칛tekatokseen. T칛ll칬in tytt칬yst칛v칛ni n칛ki taivaalla kaksi oranssia selv칛sti t칛hti칛 isompaa pistem칛ist칛 valoa, kysyen mit칛 nuo on. Niit칛 siin칛 ihmeteltiin ett칛 onpa erikoiset v칛rit, t칛ysin normaaleista lentokoneista poikkeavat, niiden et칛isyys s칛ilyi kaiken aikaa toisiinsa n칛hden samana, kun ne hiljalleen l칛hestyiv칛t meit칛. Tulivat id칛st칛 p칛in, jolloin luonnollisesti n칛in Lahdessa voisi kuvitella ett칛 kauas 	Ei	ei	ei	ei	kyll칛	http://fufora.fi/ufodb/ufodata.php?u=843&p=1	60.98267490000001	25.6612096	pime칛
http://www.suomenufotutkijat.fi/ufodb/_ufoimages/1036__1.jpg	Juuka	2014-02-08	"Olimme yst칛v칛ni kanssa k칛ym칛ss칛 Kolilla lauantaina 8.2.2014. K칛velimme noin klo 16 aikaan Ukko-kolin huipulle katselemaan maisemia. Ilma oli lauha ja lumisateinen, l칛mp칬tila nollan tienoilla. Otimme maisemista kuvia omilla puhelimillamme. Tunnelma Ukko-kolilla oli seesteinen ja hiljainen, muita kulkijoitakaan ei ollut. Emme havainneet paljaalla silm칛ll칛 mit칛칛n erikoista, emmek칛 valoja tms. Kuvia ottaessani havaitsin ett칛 linssin kuvassa v칛l칛hti jotakin ""valoa"", mutta luulin sit칛 valotusongelmaksi. Vasta kun hotellilla tutkin ottamiani kuvia, ha"	Kyll칛	ei	ei	NA	ei	http://fufora.fi/ufodb/ufodata.php?u=1036&p=1	63.2432771	29.2545883	auringonlasku_tai_nousu
http://www.suomenufotutkijat.fi/ufodb/_ufoimages/228__1.jpg	Joutsan ja Leivonm칛en v칛lill칛	2010-02-13	"Haloa tuli siis kuvattua Joutsan ja Leivom칛en v칛liss칛,  
kutakuinkin kello 16:00 paikkeilla. Ihan ok kuviahan 
niist칛 tuli, mutta viidess칛 niiss칛 on jokin ""valot칛pl칛"" joka n칛ytt칛isi  
siirtyv칛n halon keh칛n sis칛puolelta sen 
ulkopuolelle, haloon kuuluva ilmi칛 vaiko kamerasta johtuva, niin sit칛  
en osaa sanoa, kun en sit칛 t칛pl칛칛 
ainakaan huomannut kuvia otellessa, mutta vaikka en n칛hnyt, niin onhan  
se silti siell칛 voinut olla, kun  
huomioni tuolloin kiinnitin toisaalle. Keskimm칛iseksi p칛칛tynyt kuva on  
otettu auton sis칛lt칛, muut sitten 
taa"	Kyll칛	ei	ei	ei	ei	http://fufora.fi/ufodb/ufodata.php?u=228&p=1	61.93574460000001	26.0294887	kirkas p칛iv칛nvalo
http://www.suomenufotutkijat.fi/ufodb/_ufoimages/619__1.JPG	Varkaus	2012-03-08	"Olimme vaimoni kanssa ulkoterassilla ja katselimme pieni칛 revontulia joita n칛kyi v칛h칛nlaisesti. Pyysin my칬s naapuria sammuttamaan kirkkaat pihavalot, etteiv칛t ne h칛iritsisi kuvaamista. 
Otin kaksi kuvaa torstaina 08.03 noin klo kymmenen aikaan illalla. Aamulla otin kuvat koneelleni ja v칛h칛n ihmetytti kun ei ollutkaan mit칛칛n revontulia vaan toisessa kuvassa ep칛m칛칛r칛inen pallo. Kuvat otin noin 10 minuutin v칛lein. Kuvaushetkell칛 ei n칛kynyt mit칛칛n palloa. Kysymyksess칛 ei voi olla kuu, koska kuvat on otettu suoraan pohjoiseen ja kuu oli id칛n ja etel"	Kyll칛	ei	ei	ei	ei	http://fufora.fi/ufodb/ufodata.php?u=619&p=1	62.3246584	27.8961002	pime칛
NA	Janakkala	2009-04-08	Oltiin frendin kanssa tupakalla kotipihassamme, ja taivaalla n칛kyi esine joka aluksi n칛ytti satelliitilta, mutta siit칛 heijastui kahtena erillisen칛 kertana lyhyen ajan aikana kirkasta valoa. Kohde liikkui nopeasti, sill칛 olen seurannut satelliittienkin menoa ja t칛m칛 nopeampaa.	Ei	ei	ei	ei	ei	http://fufora.fi/ufodb/ufodata.php?u=37&p=1	60.92012459999999	24.6460019	pime칛
NA	Ilomantsi	2011-04-10	Olin kaverini Vesan kanssa palaamassa Helsingin matkalta autolla kohti Ilomantsia 10.4.2011 my칬h칛칛n illalla. Tulimme Joensuusta Kontiolahden kautta, koska koira piti hakea koirahoitolasta. Olimme Luhtapohjantiell칛/Enontiell칛 kohti Ilomantsia noin klo 21.15 kun huomasimme taivaalla loivasti tien vasemmalla puolella hieman ennen Tokraj칛rven risteyst칛 taivaalla kaksi pallomaista pistett칛 vertikaalisti p칛칛llekk칛in. Pallot olivat korkealla taivaalla ja n칛yttiv칛t l칛hes t칛hdilt칛, joiksi niit칛 aluksi luulimmekin. Taivas oli jo h칛m칛r칛칛n p칛in ja jonkin v	Ei	ei	ei	ei	kyll칛	http://fufora.fi/ufodb/ufodata.php?u=435&p=1	62.66788529999999	30.9394911	h칛m칛r칛
NA	Mikkeli	2010-04-13	Tulimme avovaimon kanssa sy칬m칛st칛 autolla Pohjolankatu 20,eli kotiosoitteeseen,veimme auton autokatokseen ja l칛hdimme k칛velem칛칛n autokatoksesta kohti kotirappua,huomasin taivaalla oudon  ja eritt칛in kirkkaan kohteen 13.4.2010 Mikkeliss칛(kaupungin osa Siekkil칛) klo.21:45,avovaimonikin sen n칛ki,sanoi,ett칛 on lentokone,min칛 sanoin,ei perkele varmasti ole,kohde oli eritt칛in kirkas,kuin Venus,se l칛heni meit칛 vajaan minuutin,kohde vaan kirkastui,kohde j칛i paikalleen ja ampaisi hurjalla nopeudella avaruuteen(nopeus 1000-5000km/H)Kohde oli todella kirk	Ei	kyll칛	kyll칛	ei	kyll칛	http://fufora.fi/ufodb/ufodata.php?u=258&p=1	61.68872709999999	27.2721457	h칛m칛r칛
NA	Suolahti	2010-04-25	25.04.2010 noin klo 13.00 luoteessa taivaanrannassa lenti lentokone ja sit칛 j칛imme seuraamaan. Pian huomasimme kirkkaan valopisteen joka l칛hti tulemaan kohti kaakkoa, talomme ylitse. Vaikutti kuin olisi pys칛htynyt talomme ylle ja kameraa hakiessamme kiihdytti vauhdin ja katosi pian horisonttiin. Noin 10minuutin kuluttua tytt칛reni n칛ki kaakosta pohjoiseenp칛in lentokoneelta vaikuttavan tumman/auringossa kiilt칛v칛n esineen lent칛v칛n kovaa vauhtia t칛ysin 칛칛nett칬m칛n칛. Hetken kuluttua t칛st칛 lensi toinenkin, mielest칛ni pallon muotoinen, my칬s kaakosta ka	Ei	ei	kyll칛	ei	kyll칛	http://fufora.fi/ufodb/ufodata.php?u=271&p=1	62.5679153	25.8535881	kirkas p칛iv칛nvalo
NA	Espoo	2010-04-02	"Paikka:Espoo, Matinkyl칛. 
Viime y칬n칛 2.5.2010 noin kello 1 aikaan olin sikarilla parvekkeella. 
Ensin n칛in yhden keltaista/oranssia hohtavan valon, joka lensi huomattavalla nopeudella l칛nnest칛 it칛칛n etel칛isell칛 taivaalla. Vaimoni ei huomannut kohdetta.  
Olen aikaisemminkin tehnyt samassa paikassa joitakin vastaavia havaintoja ja kerran yritin videolla kuvata kolmen samaan aikaan n칛kyv칛n kohteen lentoa, mutta videolla ei n칛y mit칛칛n. En ole n칛ist칛 havainnoista kertonut muille kuin vaimolle ja lapsille. 
Viime y칬n칛 j칛imme vaimon kanssa tarkkailem"	Ei	ei	ei	ei	kyll칛	http://fufora.fi/ufodb/ufodata.php?u=272&p=1	60.2054911	24.6559001	pime칛
NA	Helsinki	2010-04-13	"Havainnot: (L칛nsi-Pasila 13.4.2010 klo 00.15) 
Olen tiskaamassa astioita kun r칬칬kill칛 oleva k칛mppis huutaa parvekkeelta n칛hneens칛 UFO:n. Oli eritt칛in h칛miill칛칛n mutta silti vakuuttava, joten uskoin h칛nt칛. En ehtinyt j칛칛d칛 miettim칛칛n asiaa, joten palasin tiskaamaan. K칛mppis j칛i odottamaa, josko n칛kisi sen uudellee. 5min kuluttua parvekkeelta kuuluu taas huutoa, h칛n n칛ki sen uudelleen. Juoksin keitti칬st칛, mutten ehtinyt itse n칛kem칛칛n tuota tunnistamatonta esinett칛. 
Iltapalan j칛lkeen menin vessaan ja taas kuului huutoa. T칛ll칛 kertaa ehdin paikall"	Ei	ei	ei	ei	kyll칛	http://fufora.fi/ufodb/ufodata.php?u=256&p=1	60.16985569999999	24.938379	pime칛
NA	H칛meenkyr칬	2010-04-12	Olin eilen(12.4.2010 n klo 23:00)illalla tupakilla kotipihas ja kattelin kirkasta t칛htitaivasta, ku yht칛kki칛 n칛in punertavan liikkuvan kohteen ja heti per칛칛n useammam samanlaisen py칬re칛nmuotoisen kohteen. Yritin laskee montako niit칛 oli mut ne liikku niin nopeasti etten saanut tarkkaa m칛칛r칛칛 mutta n.7-10 kpl.Ne lensi ryhm칛ss칛 kierrellen toinen toistaan nopeasti, sitten ne meni yhten칛iseen riviin ja teki t칛ydellisen puolipallomuodostelman joka n칛ytti kuin c-kirjaimelta ja sen j칛lkeen taas vaihtelivat paikkoja ja katosivat taivaalta yht칛kki칛. Mit	Ei	ei	ei	ei	kyll칛	http://fufora.fi/ufodb/ufodata.php?u=257&p=1	61.6383264	23.196349	pime칛
NA	H칛meenkyr칬	2010-04-22	Olin huoneessani jossa oli pime칛칛. Sitten n칛in yll칛tt칛en ison valon, joka t칛ytti huoneeni t칛ysin. Katsoin ulos ikkunasta ja n칛in ison aluksen ja 7 pienemp칛칛 alusta. Ne olivat t칛ysin paikalla. Hetken p칛칛st칛 n칛in v칛l칛htely칛 ulkona. Katsoin taas ikkunasta ja n칛in ihmeellisi칛 viivoja joka suuntaan. Sain niit칛 kuvattuakin mutta en ole ehtinyt laittaa niit칛 koneelleni. Jos haluatte tietoa lis칛칛, saate sit칛 kyll칛. Laitoin 칛itini puhelin numeron, koska oma k칛nykk칛ni ei ole usein auki. Ja taivas oli muuten ihan pilvinen.	Ei	ei	ei	ei	kyll칛	http://fufora.fi/ufodb/ufodata.php?u=266&p=1	61.6383264	23.196349	pime칛
NA	Sastamala	2010-04-16	16.4.2010 kello 23:55 k칛vin iltatupakalla ja tapani mukaan tarkastelin t칛htitaivasta, kun se oli n칛kyviss칛. N칛in etel칛ss칛 noin 45 astetta horisontin yl칛puolella muita t칛htitaivaan kappaleita kirkkaamman vilkkuvan valon. Valo laskeutui nopeahkosti kohti horisonttia. Valo vilkahti noin sekunnin v칛lein. laskeuduttuaan muutaman sekuntin, noin 20 astetta horisontin yl칛puolella valo katosi eli vilkunta lakkasi.	Ei	kyll칛	kyll칛	ei	ei	http://fufora.fi/ufodb/ufodata.php?u=262&p=1	61.3376032	22.9184987	pime칛
NA	H칛meenlinna	2010-04-24	"24.4 klo.23.55-24.00 
Olin tupakalla parvekkeella ja n칛in taivaanrannssa kirkkaan punaisena hitaasti v칛lkkyv칛n valon, joka liikkui suunnassa l칛nis-etel칛. Kohde oli v칛rilt칛칛n suunnilleen saman punainen, kuin radiomastojen valot. Kohde ei voinut olla radiomastonvalo, kosa se liikkui yhden maston ""p칛칛lt칛"" Kohteen liikerata oli suoraviivainen, mutta melko nopea. Kohde oli suunnilleen l칛nness칛, kun huomasin sen ja sin칛 aikana kun hain kamerak칛nnykk칛ni sis칛lt칛, niin kohde oli liikkunut pitk칛lle etel칛칛n. En ehtinyt ottaa kuvaa. aikaa kamerak칛nnyk칛n ha"	Ei	ei	ei	ei	kyll칛	http://fufora.fi/ufodb/ufodata.php?u=268&p=1	60.9928787	24.4590243	pime칛
NA	Imatra	2010-04-11	"Menin omalle parvekkeelleni tupakalle, ja katselin kirkasta t칛htutaivasta. ""Jotenkin minulla oli jo sellainen tunne, ett칛 jotain n칛en taivaalla.."" Otin puhelun kaverilleni ja samalla n칛in otavan- t칛hdist칬n taivaalla, samalla n칛in kolmen valon rykelm칛n tulossa, odottakaas hetken, katson googlesta suunnan.. ..noin. id칛st칛 tulevan 3 kirkkaan valopallo rykelm칛n lent칛v칛n talomme yli.. Ne olivat symmetrisesti et칛isyydelt칛칛n erossa toisistaan. Ei jonossa eik칛 riviss칛, vaan viistomaisesti, lensiv칛t kovaa mutta n칛in ne taivaalla kuitenkin pitk칛n ajan ja"	Ei	ei	ei	ei	ei	http://fufora.fi/ufodb/ufodata.php?u=255&p=1	61.17138449999999	28.7651478	pime칛
NA	Joensuu	2010-05-06	Olin y칬 vuorossa t칬iss칛. Vesirakennusalan firmassa joensuussa. noin kello 23.30 l칛hdin kesken ty칬vuoron k칛ym칛칛n ostamassa ev칛st칛 paikalliselta abc huolto asemalta. Takaisin palattuani noin kello 00.00 J칛tin auton 50 metrin p칛칛h칛n ty칬maan taukokopista. K칛velless칛ni autolta pois p칛in n칛in kirkkaan valon lent칛v칛n joen yl칛puolella. Kohde liikkui pohjoisesta etel칛n suuntaan. T칛st칛 lent칛칛 silloin t칛ll칬in yli lentokoneita jotka ovat matkalla joensuusta etel칛칛n, mutta t칛m칛 kohde liikkui suurinpiirtein samalla korkeudella kuin lentokoneet, jotka ylitt칛v	Ei	ei	ei	ei	kyll칛	http://fufora.fi/ufodb/ufodata.php?u=273&p=1	62.6010155	29.7635719	pime칛
NA	Helsinki	2010-04-19	"Ufohavainto 19.4.2010 
Mainitun p칛iv칛n iltana noin kello 23.40 olimme naisyst칛v칛ni kanssa parvekkeella tupakalla osoitteessa Kiviteltankatu 6 Helsingiss칛, kun huomasin suunnilleen pohjoisessa (ehk칛 Kassiopeian W:n춦 l칛hist칬ll칛) kirkkaan t칛hden kaltaisen valon, joka liikkui l칛nnen puolelle hyvin lyhyen matkan. Havainnon korkeus oli ehk칛 luokkaa 20 astetta. Kohde liikkui hyvin hitaasti ja liikehdint칛 vaikutti helikopterin liikkeilt칛. Vaikutti silt칛 ett칛 kohde loittoni havainnon aikana, joskaan t칛st칛 ei ole todellista tietoa. Tuntemani lentolaitte"	Ei	ei	kyll칛	ei	kyll칛	http://fufora.fi/ufodb/ufodata.php?u=263&p=1	60.16985569999999	24.938379	pime칛
http://www.suomenufotutkijat.fi/ufodb/_ufoimages/469__1.jpg	Salo	2011-06-11	"Harrastajavalokuvaajana l칛hdin ottamaan valokuvia ukkospilvest칛 Muurlaan. Olin l칛hd칬ss칛 jo kotiinp칛in, kun aurinko tuli esiin pilvien v칛liin. Ojensin kameran auton ikkunasta ulos ja koitin suunnata aurinkoa kohti. Otin ""jatkuvalla kuvauksella"" kymmenen (10) kuvaa samasta kohdasta. Kotona katsoin kuvia ja huomasin kahdessa mustan ""tahran"". Kuvien ottamiseen meni noin 2 sekuntia ja kahdessa keskimm칛isess칛 kuvassa n칛kyy t칛m칛 ""tahra"". todella nopea esine siis, kun lensi taivaan l칛pi alle puolessa sekunnissa."	Kyll칛	ei	ei	NA	ei	http://fufora.fi/ufodb/ufodata.php?u=469&p=1	60.3900183	23.1171797	kirkas p칛iv칛nvalo
NA	Tampere	1983-01-01	Kaksi havaintoa: 1. 1983 n. tammikuu,klo 19.00 kahden kaveruksen kanssa menimme Tampereen kaukaj칛rven pohjoisrannalla olevalle laiturille tupakalle.Kiinnitimme huomiota etel칛taivaalla n칛kyv칛칛n huomattavasti normaalit칛hte칛/planeettaa kirkkaampaan valoon. Valo oli aivan vastarannan mets칛n latvusten tasolla, matkaa vastarannalle n.800m kulma n. 15- 20 astetta. Valo nousi ja laskiehk칛 n. 5 asteen kulmavaihtelulla, hitaasti edestakaisin. Hetken kuluttua esiintyi muutamia t칛hdenlennon tapaisia ilmi칬it칛 jotka lensiv칛t t칛t칛 valoa kohti.Tarkkailimme val	Ei	ei	kyll칛	ei	kyll칛	http://fufora.fi/ufodb/ufodata.php?u=679&p=1	61.4977524	23.7609535	pime칛
http://www.suomenufotutkijat.fi/ufodb/_ufoimages/905__1.jpg	Lahti	2013-07-07	7.7.2013 klo. 00.10 menin takapihalleni k칛ytt칛m칛칛n koiria. Kunnes katsoin terassilta suoraan eteenp칛in taivaalle ja ihmettelin mik칛 oli se keltainen valopallo joka tuli suoraan alasp칛in taivaalta ja hetken p칛칛st칛 se katosi. Meni hetki ja n칛in kuinka valo nousi yl칬sp칛i ja sitten tajusin niit칛 olevan kaksi jotka nousivat yl칬sp칛in ihan kuin sumuverhon takana, valot olivat siis himme칛t. Lopuksi ne katosivat. Sin칛 iltana katulamput eiv칛t olleet p칛칛ll칛. Koko tapaus kesti 2minuuttia ja oli nopeammin ohi kun kerkesin tajutakkaan. Katsoimme ett칛 siihen 	Kyll칛	ei	ei	ei	kyll칛	http://fufora.fi/ufodb/ufodata.php?u=905&p=1	60.98267490000001	25.6612096	pime칛
http://www.suomenufotutkijat.fi/ufodb/_ufoimages/907__1.jpeg	helsinki	2013-07-13	n. klo 19 istuimme koffin puistossa ja huomasimme taivaalla korkealla useita liikkuvia kirkkaita kohteita. huomasimme ett칛 niit칛 olikin hyvin paljon ja ne liikkuivat pitk칛ss칛 jonomaisessa letkassa lounaaseen p칛in. jono ei ollut symmetrinen ja jotkut kohteista kierteliv칛t toisiaan ja n칛ytti silt칛 ett칛 jotkut ns kruisaili edes takaisin jonomuodostelmasta. emme laskeneet kohteita tarkasti mutta niit칛 oli n. 100 kpl. ne kiilsiv칛t kirkkaassa p칛iv칛nvalossa korkealta taivaalta niin kirkkaasti ett칛 n칛ytti kuin pitk칛 nauha timantteja kiiltelisi taivaall	Kyll칛	ei	ei	kyll칛	kyll칛	http://fufora.fi/ufodb/ufodata.php?u=907&p=1	60.16985569999999	24.938379	kirkas p칛iv칛nvalo
http://www.suomenufotutkijat.fi/ufodb/_ufoimages/701__1.jpg	Pori	2009-01-01	Vuonna 2009 aprillip칛iv칛n칛 klo:6:00 aamulla ennen katuvalojen syttymist칛 her칛sin poikayst칛v칛ni kanssa outoihin joulukuusen v칛risiin valoihin mitk칛 loistivat sis칛lle yksi칬칬mme. Kuulin my칬s matalaa p칬rin칛칛. Todella hiljaista matalaa 칛칛nt칛. Menin aivan ikkunan viereen katsomaan mik칛 se oli. Ikkunamme alapuolella aivan reunalla meni noin 1-metrin mittainen harmaa/hopea py칬re칛 kiekko. Se meni hitaasti, kunnes k칛칛ntyi jyrk칛sti talon raunalta kohti jokea valon nopeudella. Asuimme 5-kerroksessa ja naapurissamme oli Porin Energia tehdas. Kerrostalon tak	Kyll칛	kyll칛	ei	ei	kyll칛	http://fufora.fi/ufodb/ufodata.php?u=701&p=1	61.4851393	21.7974178	pime칛
NA	츿칛nekoski	2012-08-14	Olimme veljeni kanssa kalastamassa kuhaa keitelej칛rvell칛 kun huomasimme pienen sateliittia muistuttavan valopilkun luoteis taivaalla, heti otavan alapuolella. Hetken p칛칛st칛 valopilkku laajeni valovoimaltaan v칛hint칛칛n kymmenkertaiseksi, ik칛칛n kuin olisi k칛칛nnetty valot p칛칛lle valokatkaisijasta (n. 5 sekunnin ajaksi) ja t칛m칛n j칛lkeen himmeni (ik칛칛n kuin valokatkaisijasta) j칛lleen pieneksi valopilkuksi. T칛m칛n j칛lkeen pieni valopilkku muutti selke칛sti suuntaansa.	Ei	ei	kyll칛	ei	kyll칛	http://fufora.fi/ufodb/ufodata.php?u=699&p=1	62.60146589999999	25.7278807	pime칛
NA	huittinen	2009-09-08	"8. syyskuuta 2009 n. klo. 23.00 istuimme yhdess칛 parvekkeella ja katseemme kiinnittyi taivaalla olevaan kirkkaaseen ""t칛hteen"". Iso kirkas pallo alkoi l칛henem칛칛n meit칛 kohti ja hetken kuluttua palasi taas taaksep칛in. Pallo isoni ja pieneni koko ajan. Se oli niin kirkas, ettei sit칛 pystynyt katsomaan pitk칛칛n paljain silmin. V칛lill칛 tuntui, kun pallo olisi muuttanut muotoaan neli칬ksi ja kolmioksi. Ilmi칬 kesti noin 10 min. Lopulta pallo pieneni niin, ett칛 se h칛visi kokonaan ja my칬s kaikki muut t칛hdet katosivat taivaalta. Olimme tapahtuneesta niin p"	Ei	kyll칛	ei	kyll칛	kyll칛	http://fufora.fi/ufodb/ufodata.php?u=117&p=1	61.1760632	22.698071	pime칛
NA	M칛ntyharju	2013-09-13	"Useita t칛htien kokoisia liikkuvia valoja taivaalla eri kohdissa eri suuntiin liikkuen. Suurin osa liikkui kuitenkin l칛nteen. Liikkuivat p칛칛asiassa tasaisesti, hitaahkolla nopeudella, mutta v칛lill칛 t칬ks칛hdellen tai liev칛sti mutkitellen. Kohteita kulki pitkin taivasta toistuvasti koko 20min aikana, mutta sen verran v칛h칛n, etten n칛hnyt koskaan n칛k칬kent칛ss칛 kerralla kuin yhden. Yksi kohteista vilkahteli kirkkaasti ep칛tasaisin v칛liajoin. Muut olivat tasaisen vaaleita. 
Voivatko n칛m칛 olla sateliittej칛? Eiv칛tk칬s sateliitit kuitenkin kulje tasaisesti? "	Ei	ei	ei	NA	kyll칛	http://fufora.fi/ufodb/ufodata.php?u=946&p=1	61.41761330000001	26.8805117	pime칛
NA	Ylivieska	2013-09-14	14.913 Ylivieskassa Koskitanhua 20:ss칛 klo. 21.15(lmt) katsellessani pime칛lle taivaalle havaitsin etel칛n suunnasta l칛hestyv칛n kaksi eritt칛in kookasta valopalloa. Kohteet lensiv칛t per칛kk칛in kohti pohjoista hieman eri lentoradoilla. N칛yttiv칛t olevan eritt칛in matalalla mutta mit칛칛n 칛칛nt칛 ei kuulunut. Kohteet olivat n칛kyviss칛 koko ajan mit칛 takapihaltani oli mahdollista havaita, ajallisesti n. 5 min. Kirkkaus oli koko ajan vakio. Ilmailun ammattilaisena, aktiivisena t칛htiharrastajana sek칛 satelliittibongarina t칛lle havainnolle en keksinyt mit칛칛n lo	Ei	ei	ei	ei	kyll칛	http://fufora.fi/ufodb/ufodata.php?u=948&p=1	64.07234199999999	24.5335825	pime칛
NA	Turku	2013-09-14	"Noin klo 01.30 kaverini havaitsi t칛hdenlennon, joka teki ""silmukan"". Hetken p칛칛st칛 h칛n n칛ki toisen, ja silloin n칛in ilmi칬n itsekin. Oranssinkeltainen valo, joka ik칛칛nkuin n칛ytti hehkuvan lensi havaintoalueen yli sangen nopealla vauhdilla. Seuraavan puolen tunnin aikana n칛it칛 nopeasti lent칛vi칛 valoja bongattiin viel칛 noin kymmenen. 
Mit칛칛n 칛칛nt칛 n칛m칛 valot eiv칛t pit칛neet. Tosin outoa 칛칛nt칛 v칛lill칛 kuului, mutta lintujen 칛칛nelt칛 ne eiv칛t kuulostaneet, vaan pikemminkin jyrsij칬iden 칛칛nilt칛 (degut, hiiret). L칛hist칬ll칛 on kyll칛 puita, joten ehk칛 alue"	Ei	ei	ei	ei	kyll칛	http://fufora.fi/ufodb/ufodata.php?u=947&p=1	60.4518126	22.2666303	pime칛
http://www.suomenufotutkijat.fi/ufodb/_ufoimages/1131__1.JPG	Orimattila	2010-08-31	Kuvasin t칛htitavasta ja kun koneella katsoin kuvia niin kyseinen ilmi칬 pisti silm칛칛n.	Kyll칛	ei	kyll칛	ei	kyll칛	http://fufora.fi/ufodb/ufodata.php?u=1131&p=1	60.80171339999999	25.7288398	pime칛
http://www.suomenufotutkijat.fi/ufodb/_ufoimages/140__1.jpg	Rauma	2006-06-15	"TERVE TUTKIJAT ! 
OLIN KISSANI KANSSA KVELYLL츿 VIIKOLLA 24. RAUMALLA...... 
KAMERA ON AINA MUKANA JA NOI IIN-MUOTOISET PILVET KIINNITTIV츿T 
HUOMIONI JA N츿PP츿ILIN NE NIKONIN MUISTIIN...... 
NO.....TALLENSIN NE TIETOKONEELLENI JA HUOMIOIN ETT츿 KUVAN ALAREUNASSA   
ON JOKIN 
""LAITE"" ,  JOKA ILMEISESTI AIHEUTTAA KYSEISET MUODOSTELMAT...... 
NO NIIN ,  ONKO TUTTU ? ......EI TULE OIKEIN HETI MIELEENI........ 
MIK츿 T츿LL츿IST츿 J츿LKE츿 TEKEE....츿츿NETT칐M츿STI........................ 
HELIKOPTERI ?.......TAITOLENTOKONE ?........... 
KUVAUSHETKELL츿 EN HUOMANN"	Kyll칛	ei	ei	ei	ei	http://fufora.fi/ufodb/ufodata.php?u=140&p=1	61.1308854	21.5059264	kirkas p칛iv칛nvalo
http://www.suomenufotutkijat.fi/ufodb/_ufoimages/996__1.JPG	Salo	2013-12-13	"Olin taloni rapusilla ja katseeni kiinnittyi taivaan rannassa olevaan  
valoon,katselin sit칛 noin 5 minuuttia t칛n칛 aikana kohde ei liikkunut,  
ensin ep칛ilin voisiko olla kuumailmapallo tai linjojen raivaus helikopteri,t칛칛ll칛 oli tuo Seija mysky,kohteesta ei kuulunut 칛칛nt칛 ja pysyi paikalaan koko ajan.Valo oli h칛vinnyt kun menin hetkeksi sis칛칛n, sit칛 ei ollut en칛칛 tultuani ulos.Tytt칬ni n칛ki saman ilmi칬n ja oli ottanut kuvan,itse en tiennyt h칛nen ottaneen kuvaa.Illalla juteltiin asiasta 
em칛nn칛n kanssa h칛n ei meinannut uskoa asiaa,jolloin tytt칬n"	Kyll칛	kyll칛	kyll칛	ei	kyll칛	http://fufora.fi/ufodb/ufodata.php?u=996&p=1	60.3900183	23.1171797	pime칛
http://www.suomenufotutkijat.fi/ufodb/_ufoimages/1171__1.jpg	Vanajanj칛rvi	1980-07-01	"Lekottelin helteell칛 luodolla ja avasin silm칛ni. Laitoin lasit p칛칛h칛n ja nousin istumaan ja katsomaan tarkemmin. Se ei liikkunut, minusta korkeintaan poisp칛in ja senkin hitaasti. 
Mik칛칛n j칛rkeenk칛yp칛 ei tullut mieleen. Katsoin ehk칛 10-20 minuuttia. Hain juotavaa ja sill칛 aikaa se oli kadonnut. Harmittaa kuin poistuin hetkeksi. 
Odotin ett칛 ilmavirta olisi saanut sen vaappumaan edes v칛h칛n mutta se pysyi vakaasti pystyasennossa ja oli minusta isohko."	Kyll칛	ei	ei	ei	ei	http://fufora.fi/ufodb/ufodata.php?u=1171&p=1	62.38333329999999	26.7333333	kirkas p칛iv칛nvalo
http://www.suomenufotutkijat.fi/ufodb/_ufoimages/449__1.jpg	Tampere	2011-04-27	Astuin ulos ovesta.Huomasin heti suunilleen 70 asteen katselukulmassa minusta poisp칛in vaakatasossa tasaista nopeutta lent칛v칛n kirkkaan 칛칛nett칬m칛n valopallon.Sen lentosuunta oli kaakon ja etel칛n v칛liss칛,l칛hemp칛n칛 kaakkoa,ja korkeudeksi arvioin 2km +- 1km.Sieppasin k칛nnyk칛n taskusta,laitoin kameran p칛칛lle ja zoomin t칛ysille ja nappasin kuvan.Kuvan otto hetkeen menness칛 valopallo oli edennyt suunilleen 50 asteen katselukulmaan.Seurasin sit칛 kunnes se lensi niin kauas,ettei sit칛 en칛칛 erottanut paljaalla silm칛ll칛.H칛vitess칛칛n n칛kyvist칛 valopallo oli	Kyll칛	ei	ei	ei	kyll칛	http://fufora.fi/ufodb/ufodata.php?u=449&p=1	61.4977524	23.7609535	h칛m칛r칛
